rowid,OrganizationID,FullName,AgencyURL,MailAddress,BeginDt,EndDt,UpdateDt,UpdateUserID,ListFipsCounty,ListPDOs,POP_COUNT,FI_AGGREGATE,PUBLIC_FI,WT_ANNUAL_DOLLARS,COST_PER_MEAL,Twitter,FaceBook,SocialUrls,LogoUrls,VolunteerURL,VolunteerCoord,VolunteerEmail,VolunteerPhone,VolunteerPhoneExtension,CHILD_FI_COUNT,CHILD_FI_PCT,CHILD_FI_BELOW_PCT,CHILD_FI_ABOVE_PCT,EntityID,Phone,Fax,Type,Region,DistributionFlag,URL,DemographicStats,OperationsStats,FoodDistributionProgStats,ClientSupportProgStats,NationalProgStats,PoundageStats,AgenciesServedStats,SubType,ED,MediaContact
54,80,"America's Second Harvest of Coastal Georgia, Inc.",http://www.helpendhunger.org/find-food-assistance/,0001-01-01T00:00:000001-01-01T00:00:0073-81.044289432.06640932501 East President StreetSavannahGA31404    31404,2008-04-04T14:46:54,,2018-06-15T16:26:29.03,,13001APPLINGGA184710.14927401.300SNAP1.850Other Nutrition Program0.7200.0900.20012840002.750.23410900.8700.13013005BACONGA112790.13915701.300SNAP1.850Other Nutrition Program0.5800.1700.2507190002.680.2346800.8700.13013025BRANTLEYGA184110.13324501.300SNAP1.850Other Nutrition Program0.7200.1900.09012840003.070.23810701.0000.00013029BRYANGA348830.11238901.300SNAP1.850Other Nutrition Program0.5000.0900.41022480003.390.18418800.5700.43013031BULLOCHGA737420.196144701.300SNAP1.850Other Nutrition Program0.6000.0900.31074790003.030.23334600.7100.29013039CAMDENGA522520.13067801.300SNAP1.850Other Nutrition Program0.4700.2100.33037490003.240.20626600.7300.27013043CANDLERGA108940.17419001.300SNAP1.850Other Nutrition Program0.7200.1200.1509390002.900.2577100.7700.23013049CHARLTONGA129630.15219701.300SNAP1.850Other Nutrition Program0.5800.1000.32011010003.270.2466200.7700.23013051CHATHAMGA2855060.166473101.300SNAP1.850Other Nutrition Program0.5000.1400.360264900003.280.205129000.6400.36013103EFFINGHAMGA570870.09655001.300SNAP1.850Other Nutrition Program0.4400.1800.38028220003.010.17426700.6100.39013109EVANSGA107570.16117301.300SNAP1.850Other Nutrition Program0.6400.0700.2908930003.030.2386800.6900.31013127GLYNNGA834670.151125801.300SNAP1.850Other Nutrition Program0.5600.1500.30071420003.330.22542900.7500.25013161JEFF DAVISGA149990.13520301.300SNAP1.850Other Nutrition Program0.6800.1400.1809440002.720.2259100.9200.08013179LIBERTYGA621200.173107201.300SNAP1.850Other Nutrition Program0.5400.2800.18053600002.930.20436400.8200.18013183LONGGA178570.13924901.300SNAP1.850Other Nutrition Program0.6300.1800.20012140002.860.21711000.8100.19013191MC INTOSHGA140610.15922301.300SNAP1.850Other Nutrition Program0.5600.1600.29011730003.080.2275700.7500.26013209MONTGOMERYGA89620.15313701.300SNAP1.850Other Nutrition Program0.4800.1400.3806370002.720.2274400.7300.27013229PIERCEGA191410.12924701.300SNAP1.850Other Nutrition Program0.6100.1000.30011490002.730.22110700.7200.28013267TATTNALLGA254020.15739801.300SNAP1.850Other Nutrition Program0.5000.1500.36018210002.680.24312900.8400.16013279TOOMBSGA271600.16945801.300SNAP1.850Other Nutrition Program0.7000.1300.18022450002.870.23217100.8000.20013305WAYNEGA298330.15646501.300SNAP1.850Other Nutrition Program0.5600.1700.28021880002.760.22416500.7700.230,,889247,0.155,137410,0,0.00,helpendhungerga,http://www.facebook.com/Help.End.Hunger.Ga?ref=ts,http://www.facebook.com/Help.End.Hunger.Ga?ref=tshelpendhungergahttp://www.helpendhunger.org/take-action/donate/,http://help.feedingamerica.org/images_logos/FoodBankLogo_80_275w.jpghttps://secure.feedingamerica.org/images_logos/FoodBankLogo_80_275w.jpg,http://www.helpendhunger.org/take-action/volunteer/,Angie Johnson,ajohnson@helpendhunger.org,912.236.6750,          ,45090,0.213,0.720,0.280,73,912.236.6750,912.231.9776,MBR,North,false,www.helpendhunger.org,,,,,,1554981012949495true,,FB,"2008-10-10T00:00:002018-06-15T16:26:29.047116Mary JaneCrouch Mary Jane   CrouchCrouch, Mary Jane  MaleExecutive Director9122366750          912.236.6750912.231.9776mcrouch@helpendhunger.org80","2008-10-10T00:00:002018-06-15T16:26:29.047326Mary JaneCrouch Mary Jane   CrouchCrouch, Mary Jane  MaleExecutive Director9122366750          912.236.6750912.231.9776mcrouch@helpendhunger.org80"
174,23,Coastal Bend Food Bank,https://coastalbendfoodbank.org/get-help/find-food/,0001-01-01T00:00:000001-01-01T00:00:0022-97.455316327.8014139826 Krill St.Corpus ChristiTX78408    78408,2008-04-04T14:46:54,,2020-02-06T11:56:31.23,,48007ARANSASTX248320.16541001.650SNAP1.850Other Nutrition Program0.6500.0200.33020640002.950.26312400.7100.29048025BEETX327290.13945401.650SNAP1.850Other Nutrition Program0.5800.0600.36020040002.590.25417900.6700.33048047BROOKSTX72510.14710701.650SNAP1.850Other Nutrition Program0.7700.0300.2004660002.550.3486900.6900.31048131DUVALTX114340.10411901.650SNAP1.850Other Nutrition Program0.8700.0100.1205290002.610.2717800.6900.32048249JIM WELLSTX413180.10744201.650SNAP1.850Other Nutrition Program0.8200.0300.15019310002.560.25930400.6500.35048261KENEDYTX5640.116701.650SNAP1.850Other Nutrition Program0.8200.0300.150310002.560.234400.4300.57048273KLEBERGTX315400.13041001.650SNAP1.850Other Nutrition Program0.7600.0000.24019350002.770.23718300.6100.39048297LIVE OAKTX120430.12515001.650SNAP1.850Other Nutrition Program0.5700.0400.3906970002.720.2305500.6200.39048311MC MULLENTX6000.070401.650SNAP1.850Other Nutrition Program0.8900.1100.000190002.790.201300.5600.44048355NUECESTX3584840.116416601.650SNAP1.850Other Nutrition Program0.7300.0300.250198900002.800.225203200.6400.36048409SAN PATRICIOTX668670.12482801.650SNAP1.850Other Nutrition Program0.6800.0500.26038650002.740.24344400.6700.330,,587662,0.121,70970,0,0.00,CoastalBendFB,http://www.facebook.com/Coastalbendfoodbank/,http://www.facebook.com/Coastalbendfoodbank/CoastalBendFBhttps://coastalbendfoodbank.org/get-involved/give-funds/,http://help.feedingamerica.org/images_logos/FoodBankLogo_23_275w.jpghttps://secure.feedingamerica.org/images_logos/FoodBankLogo_23_275w.jpg,https://coastalbendfoodbank.org/get-involved/give-time/,James Burnett ,,361.887.6291,          ,34750,0.236,0.650,0.350,22,361.887.6291,361.887.7687,MBR,North,false,coastalbendfoodbank.org/,,,,,,98498568066968true,,FB,"2008-10-10T00:00:002020-02-06T11:56:31.37231BeaHanson Bea   HansonHanson, Bea  MaleExecutive Director3618876291          361.887.6291361.887.7687bhanson@coastalbendfoodbank.org23","2008-10-10T00:00:002020-02-06T11:56:31.463441BeaHanson Bea   HansonHanson, Bea  MaleExecutive Director3618876291105       361.887.6291 X105       361.887.7687bhanson@coastalbendfoodbank.org23"
146,197,Toledo Northwestern Ohio Food Bank,http://www.toledofoodbank.org/get-help/?doing_wp_cron=1571775894.0716230869293212890625,0001-01-01T00:00:000001-01-01T00:00:00151-83.544814141.660313624 East Woodruff AvenueToledoOH43604    43604,2008-04-04T14:46:54,,2019-10-22T16:16:09.673,,39039DEFIANCEOH383110.10741001.300SNAP1.850Other Nutrition Program0.4700.1100.42017690002.530.18216300.6100.39039051FULTONOH422960.10444001.300SNAP1.850Other Nutrition Program0.4500.1400.41021500002.860.17918500.6100.39039069HENRYOH274630.10227901.300SNAP1.850Other Nutrition Program0.4200.1300.46012450002.620.17511500.5400.46039095LUCASOH4334040.175756501.300SNAP1.850Other Nutrition Program0.5900.1100.310358050002.770.222222700.6900.31039123OTTAWAOH407690.11848201.300SNAP1.850Other Nutrition Program0.4500.1500.40025660003.120.20215900.6500.35039143SANDUSKYOH595590.11970901.300SNAP1.850Other Nutrition Program0.5400.1300.33030240002.500.19026100.6700.33039171WILLIAMSOH370610.11944001.300SNAP1.850Other Nutrition Program0.5200.1800.30020960002.790.19616700.7800.22039173WOODOH1295040.125162201.300SNAP1.850Other Nutrition Program0.4900.0900.43077650002.810.16544000.5400.470,,808367,0.148,119470,0,0.00,toledofoodbank,http://www.facebook.com/toledofoodbank,http://www.facebook.com/toledofoodbanktoledofoodbankhttps://toledonwohiofoodbank.networkforgood.com/projects/12831-toledo-northwestern-ohio-food-bank,http://help.feedingamerica.org/images_logos/FoodBankLogo_197_275w.jpghttps://secure.feedingamerica.org/images_logos/FoodBankLogo_197_275w.jpg,http://www.toledofoodbank.org/get-involved-option-1/,Darlene Sopko,,419.242.5000,203       ,37170,0.203,0.660,0.340,151,419.242.5000,419.241.4455,MBR,North,false,www.toledofoodbank.org,,,,,,60594035003531true,,FB,"2008-10-10T00:00:002019-10-22T16:16:09.69200JamesCaldwellMJames M CaldwellCaldwell, James MMalePresident/CEO4192425000          419.242.5000419.241.4455jcaldwell@toledofoodbank.org197","2008-10-10T00:00:002019-10-22T16:16:09.69410NikeishaCrossLNikeisha L CrossCross, Nikeisha LMaleResource Grants/Data Entry/Social Media4192425000          419.242.5000419.241.4455ncross@toledofoodbank.org197"
153,29,Second Harvest Food Bank of Northwest Pennsylvania,http://nwpafoodbank.org/need-help/need-help/,0001-01-01T00:00:000001-01-01T00:00:0028-80.11228442.1095371507 Grimm DriveEriePA16501    16501,2008-04-04T14:46:54,,2017-01-11T09:43:04.663,,42023CAMERONPA47540.1326301.600SNAP1.850Other Nutrition Program0.6100.0800.3103280003.050.2131800.8000.20042031CLARIONPA387470.13452001.600SNAP1.850Other Nutrition Program0.6100.0400.35023370002.630.19514200.7200.28042033CLEARFIELDPA805390.12398901.600SNAP1.850Other Nutrition Program0.6200.0500.33049290002.920.20230300.8200.18042039CRAWFORDPA868470.123106901.600SNAP1.850Other Nutrition Program0.6400.0500.32052950002.900.18734500.7900.22042047ELKPA307810.10030901.600SNAP1.850Other Nutrition Program0.5700.0700.36017230003.270.16610100.7500.25042049ERIEPA2777940.139385901.600SNAP1.850Other Nutrition Program0.6100.0300.360198450003.010.197119300.7300.27042053FORESTPA73880.14510701.600SNAP1.850Other Nutrition Program0.2500.0300.7305130002.810.2441600.6000.40042065JEFFERSONPA442580.12053301.600SNAP1.850Other Nutrition Program0.6200.0700.31024160002.660.18917800.8000.20042083MC KEANPA420700.13355801.600SNAP1.850Other Nutrition Program0.6200.0300.35030830003.240.21317900.7600.24042121VENANGOPA528800.12164101.600SNAP1.850Other Nutrition Program0.6200.0700.31029910002.730.19320600.7700.23042123WARRENPA403450.11546501.600SNAP1.850Other Nutrition Program0.6000.0700.34021410002.700.19315300.7600.240,,706403,0.129,91130,0,0.00,NWPAFoodBank,http://www.facebook.com/pages/Second-Harvest-Food-Bank-of-NW-PA/175565862500886,http://www.facebook.com/pages/Second-Harvest-Food-Bank-of-NW-PA/175565862500886NWPAFoodBankhttp://nwpafoodbank.org/get-involved/donate-funds/,http://help.feedingamerica.org/images_logos/FoodBankLogo_29_275w.jpghttps://secure.feedingamerica.org/images_logos/FoodBankLogo_29_275w.jpg,http://nwpafoodbank.org/get-involved/donate-time/,Samantha Lynch,slynch@eriefoodbank.org ,814.459.3663,108       ,28340,0.195,0.760,0.240,28,814.459.3663,814.456.6481,MBR,North,false,www.nwpafoodbank.org,,,,,,107536978789259false,,FB,"2008-10-10T00:00:002017-01-11T09:43:04.68210KarenSeggi Karen   SeggiSeggi, Karen  MaleExecutive Director8144593663          814.459.3663814.456.6481kseggi@nwpafoodbank.org29","2008-10-10T00:00:002017-01-11T09:43:04.683420ZacharyWebb Zachary   WebbWebb, Zachary  MaleDevelpomer Manager8144593663114       814.459.3663 X114       814.456.6481zwebb@eriefoodbank.org29"
138,18,"Greater Cleveland Food Bank, Inc.",http://www.greaterclevelandfoodbank.org/get-help,0001-01-01T00:00:000001-01-01T00:00:0017-81.574757541.566970915500 South Waterloo RoadClevelandOH44110    44110,2008-04-04T14:46:54,,2020-02-05T11:06:27.403,,39005ASHLANDOH532990.12968901.300SNAP1.850Other Nutrition Program0.5200.1100.37032430002.760.20525000.7200.28039007ASHTABULAOH986220.152150301.300SNAP1.850Other Nutrition Program0.6300.1400.24071080002.770.23652400.8600.14039035CUYAHOGAOH12574010.1842311901.300SNAP1.850Other Nutrition Program0.5500.1200.3401232000003.120.215576100.6600.34039055GEAUGAOH938950.09286301.300SNAP1.850Other Nutrition Program0.3700.1500.48047920003.250.16136000.6200.38039085LAKEOH2297010.112257701.300SNAP1.850Other Nutrition Program0.3700.1500.480133250003.030.17282200.5400.46039139RICHLANDOH1215330.150182501.300SNAP1.850Other Nutrition Program0.5400.1400.33085790002.750.21356300.7900.220,"17514Country Neighbor Program, Inc.P.O. Box 212OrwellOH44076KlingensmithBarbara                                   barbk@countryneighbor.orghttp://www.countryneighbor.org/39007AshtabulaOH0000000000000039055GeaugaOH00000000000000440.437.6311440.437.1031",1854451,0.165,305760,0,0.00,CleFoodBank,http://www.facebook.com/ClevelandFoodbank,http://www.facebook.com/ClevelandFoodbankCleFoodBankhttp://www.greaterclevelandfoodbank.org/give-help/donate-food-fundshttps://secure.feedingamerica.org/site/SPageServer?pagename=GSNAP_Survey&s_src=X14YCLEVE,http://help.feedingamerica.org/images_logos/FoodBankLogo_18_275w.jpghttps://secure.feedingamerica.org/images_logos/FoodBankLogo_18_275w.jpg,http://www.greaterclevelandfoodbank.org/give-help/volunteer,, jszczepanik@clevelandfoodbank.org ,216.738.2069,          ,82800,0.208,0.670,0.330,17,216.738.2265,216.738.1604,MBR,North,false,www.GreaterClevelandFoodBank.org,,,,,,4426752936407856true,,FB,"2008-10-10T00:00:002020-02-05T11:06:27.48190KristinWarzocha Kristin   WarzochaWarzocha, Kristin  MalePresident and CEO2167382265          216.738.2265216.738.1604kwarzocha@clevelandfoodbank.org18","2008-10-10T00:00:002020-02-05T11:06:27.51400KarenPozna Karen   PoznaPozna, Karen  MaleDirector of Communications and Special E2167382132          216.738.2132216.738.1604kpozna@clevelandfoodbank.org18"
42,563,Treasure Coast Food Bank,https://stophunger.org/get-help-agency-locator/,0001-01-01T00:00:000001-01-01T00:00:00233-80.36061827.450884401 Angle Rd.Ft. PierceFL34947    34947,2012-09-05T13:10:49.057,,2018-06-04T13:42:22.64,,"12061INDIAN RIVERFL1479810.131193702.000SNAP, Other Nutrition Programs2.000SNAP, Other Nutrition Programs0.7200.0000.280121230003.670.20652500.8100.19012085MARTINFL1557190.113176502.000SNAP, Other Nutrition Programs2.000SNAP, Other Nutrition Programs0.6100.0000.390106340003.530.18147400.6700.33012093OKEECHOBEEFL402280.13654802.000SNAP, Other Nutrition Programs2.000SNAP, Other Nutrition Programs0.8400.0000.16025860002.770.23020400.8300.17012111ST. LUCIEFL2987630.148441902.000SNAP, Other Nutrition Programs2.000SNAP, Other Nutrition Programs0.7500.0000.250239440003.180.213131000.7500.250",,642691,0.135,86690,0,0.00,tcfoodbank,http://www.facebook.com/tcfoodbank,"http://www.facebook.com/tcfoodbanktcfoodbankhttps://treasurecoastfoodbank.salsalabs.org/give/index.html

",http://help.feedingamerica.org/images_logos/FoodBankLogo_563_275w.jpghttps://secure.feedingamerica.org/images_logos/FoodBankLogo_563_275w.jpg,https://stophunger.org/volunteer-opportunities/,NA,NA, ,NA,25130,0.206,0.750,0.250,251,772.489.3034,772.489.2988,MBR,North,false,www.stophunger.org,,,,,,105325698494343true,,FB,"2012-09-05T13:10:49.12018-06-04T13:42:22.67560JudithCruzAJudith A CruzCruz, Judith AMaleExecutive Director  jcruz@tcfoodbank.org563","2012-09-05T13:10:49.1132018-06-04T13:42:22.67561KristaGarofalo Krista   GarofaloGarofalo, Krista  MaleChief Public Relations & Strategy Office7724893034          772.489.3034 kgarofalo@tcfoodbank.org563"
116,220,Great Plains Food Bank,https://greatplainsfoodbankorg.presencehost.net/get_help/pantries_and_soup_kitchens.html,0001-01-01T00:00:000001-01-01T00:00:00163-96.809740446.8788511720 3rd Avenue NorthFargoND58102    58102,2008-04-04T14:46:54,,2018-10-26T11:57:45.467,,"27027CLAYMN620400.09760401.650SNAP1.850Other Nutrition Program0.5900.0300.39031540003.060.13019100.7100.29038001ADAMSND23680.0641502.000SNAP, Other Nutrition Programs2.000SNAP, Other Nutrition Programs0.7200.0000.280850003.330.093400.4300.58038003BARNESND109710.0697602.000SNAP, Other Nutrition Programs2.000SNAP, Other Nutrition Programs0.5600.0000.4404120003.180.1032200.4300.57038005BENSONND68750.1379402.000SNAP, Other Nutrition Programs2.000SNAP, Other Nutrition Programs0.7800.0000.2204960003.090.2245300.7200.28038007BILLINGSND9830.053502.000SNAP, Other Nutrition Programs2.000SNAP, Other Nutrition Programs0.6600.0000.340300003.490.089200.6500.35038009BOTTINEAUND66510.0604002.000SNAP, Other Nutrition Programs2.000SNAP, Other Nutrition Programs0.6200.0000.3802220003.250.0961300.5000.50038011BOWMANND32260.0461502.000SNAP, Other Nutrition Programs2.000SNAP, Other Nutrition Programs0.4800.0000.520860003.370.069500.1700.83038013BURKEND22530.0541202.000SNAP, Other Nutrition Programs2.000SNAP, Other Nutrition Programs0.8100.0000.200690003.380.092600.6100.39038015BURLEIGHND923720.06055402.000SNAP, Other Nutrition Programs2.000SNAP, Other Nutrition Programs0.5500.0000.45030890003.270.08818700.4600.54038017CASSND1706200.085144202.000SNAP, Other Nutrition Programs2.000SNAP, Other Nutrition Programs0.6200.0000.38078280003.180.09234700.5200.48038019CAVALIERND38170.0511902.000SNAP, Other Nutrition Programs2.000SNAP, Other Nutrition Programs0.6200.0000.3801020003.140.100800.4400.56038021DICKEYND50410.0502502.000SNAP, Other Nutrition Programs2.000SNAP, Other Nutrition Programs0.6800.0000.3301300003.060.067700.3400.66038023DIVIDEND23780.0641502.000SNAP, Other Nutrition Programs2.000SNAP, Other Nutrition Programs0.5200.0000.480900003.520.082400.3000.70038025DUNNND43490.0542302.000SNAP, Other Nutrition Programs2.000SNAP, Other Nutrition Programs0.6500.0000.3501370003.490.086800.4800.53038027EDDYND23210.0831902.000SNAP, Other Nutrition Programs2.000SNAP, Other Nutrition Programs0.6000.0000.4001020003.140.134700.6100.39038029EMMONSND33890.0692402.000SNAP, Other Nutrition Programs2.000SNAP, Other Nutrition Programs0.7000.0000.3001340003.260.089600.6400.37038031FOSTERND33180.0531802.000SNAP, Other Nutrition Programs2.000SNAP, Other Nutrition Programs0.7000.0000.300960003.140.087600.9900.01038033GOLDEN VALLEYND18920.0691302.000SNAP, Other Nutrition Programs2.000SNAP, Other Nutrition Programs0.9400.0000.070770003.490.110500.7900.22038035GRAND FORKSND701300.10170502.000SNAP, Other Nutrition Programs2.000SNAP, Other Nutrition Programs0.6300.0000.37037400003.110.10515100.6200.38038037GRANTND23870.0641502.000SNAP, Other Nutrition Programs2.000SNAP, Other Nutrition Programs0.7300.0000.270840003.290.099500.5700.43038039GRIGGSND22760.0661502.000SNAP, Other Nutrition Programs2.000SNAP, Other Nutrition Programs0.6600.0000.340810003.160.102500.6500.36038041HETTINGERND26010.0481202.000SNAP, Other Nutrition Programs2.000SNAP, Other Nutrition Programs0.7500.0000.250690003.360.099500.6200.38038043KIDDERND24570.0521302.000SNAP, Other Nutrition Programs2.000SNAP, Other Nutrition Programs1.0000.0000.000720003.250.096500.9800.02038045LA MOUREND41060.0582402.000SNAP, Other Nutrition Programs2.000SNAP, Other Nutrition Programs0.6800.0000.3301300003.170.104900.5800.42038047LOGANND19320.046902.000SNAP, Other Nutrition Programs2.000SNAP, Other Nutrition Programs0.7200.0000.280500003.250.073300.6800.32038049MC HENRYND59510.0543202.000SNAP, Other Nutrition Programs2.000SNAP, Other Nutrition Programs0.6500.0000.3501780003.260.1001400.5300.48038051MC INTOSHND26800.0601602.000SNAP, Other Nutrition Programs2.000SNAP, Other Nutrition Programs0.7100.0000.290860003.130.089400.7500.25038053MC KENZIEND116790.0667702.000SNAP, Other Nutrition Programs2.000SNAP, Other Nutrition Programs0.5700.0000.4304580003.480.1123800.4900.51038055MC LEANND96070.0535102.000SNAP, Other Nutrition Programs2.000SNAP, Other Nutrition Programs0.6400.0000.3602850003.280.1012000.6000.41038057MERCERND86370.0494202.000SNAP, Other Nutrition Programs2.000SNAP, Other Nutrition Programs0.5100.0000.4902360003.290.0931800.2900.71038059MORTONND300590.05717302.000SNAP, Other Nutrition Programs2.000SNAP, Other Nutrition Programs0.6000.0000.4009570003.240.0895900.5100.49038061MOUNTRAILND99860.0565602.000SNAP, Other Nutrition Programs2.000SNAP, Other Nutrition Programs0.6500.0000.3503260003.410.1022600.4800.52038063NELSONND29710.0591802.000SNAP, Other Nutrition Programs2.000SNAP, Other Nutrition Programs0.6400.0000.360950003.100.103600.6600.34038065OLIVERND18220.036702.000SNAP, Other Nutrition Programs2.000SNAP, Other Nutrition Programs0.5300.0000.470390003.270.080300.1300.87038067PEMBINAND70500.0533702.000SNAP, Other Nutrition Programs2.000SNAP, Other Nutrition Programs0.7300.0000.2701970003.120.0921300.5400.46038069PIERCEND42720.0903802.000SNAP, Other Nutrition Programs2.000SNAP, Other Nutrition Programs0.6500.0000.3502090003.220.1481300.5400.46038071RAMSEYND115740.0799102.000SNAP, Other Nutrition Programs2.000SNAP, Other Nutrition Programs0.6100.0000.3904810003.100.1082900.4900.51038073RANSOMND54110.0542902.000SNAP, Other Nutrition Programs2.000SNAP, Other Nutrition Programs0.7600.0000.2401570003.180.0781000.9200.09038075RENVILLEND25430.037902.000SNAP, Other Nutrition Programs2.000SNAP, Other Nutrition Programs0.9500.0000.050500003.270.071400.7300.27038077RICHLANDND163330.0619902.000SNAP, Other Nutrition Programs2.000SNAP, Other Nutrition Programs0.6600.0000.3405230003.090.0923200.5600.44038079ROLETTEND146570.16824602.000SNAP, Other Nutrition Programs2.000SNAP, Other Nutrition Programs0.7800.0000.23012900003.070.26213000.7800.22038081SARGENTND38830.0421602.000SNAP, Other Nutrition Programs2.000SNAP, Other Nutrition Programs0.7000.0000.300860003.160.070500.4600.54038083SHERIDANND14030.0841202.000SNAP, Other Nutrition Programs2.000SNAP, Other Nutrition Programs0.6100.0000.390670003.270.152300.6400.36038085SIOUXND44200.1607102.000SNAP, Other Nutrition Programs2.000SNAP, Other Nutrition Programs0.7800.0000.2203940003.250.2153600.6700.33038087SLOPEND6740.053402.000SNAP, Other Nutrition Programs2.000SNAP, Other Nutrition Programs0.6600.0000.340230003.380.064100.3200.68038089STARKND303160.05617002.000SNAP, Other Nutrition Programs2.000SNAP, Other Nutrition Programs0.6000.0000.4009750003.360.0785900.4600.54038091STEELEND19150.029602.000SNAP, Other Nutrition Programs2.000SNAP, Other Nutrition Programs0.5800.0000.420320003.160.072300.4100.59038093STUTSMANND210580.07115002.000SNAP, Other Nutrition Programs2.000SNAP, Other Nutrition Programs0.6000.0000.4008120003.170.1154900.6400.36038095TOWNERND22580.0641402.000SNAP, Other Nutrition Programs2.000SNAP, Other Nutrition Programs0.7700.0000.240740003.090.110600.8600.14038097TRAILLND80500.0514102.000SNAP, Other Nutrition Programs2.000SNAP, Other Nutrition Programs0.6500.0000.3502200003.140.0761400.4900.51038099WALSHND109200.0535802.000SNAP, Other Nutrition Programs2.000SNAP, Other Nutrition Programs0.9100.0000.0903070003.100.0952300.7400.26038101WARDND696280.07149402.000SNAP, Other Nutrition Programs2.000SNAP, Other Nutrition Programs0.6400.0000.36027650003.280.09916100.6000.40038103WELLSND40890.0512102.000SNAP, Other Nutrition Programs2.000SNAP, Other Nutrition Programs0.7500.0000.2501160003.250.074600.6200.39038105WILLIAMSND329160.05819102.000SNAP, Other Nutrition Programs2.000SNAP, Other Nutrition Programs0.6000.0000.40011210003.440.0938100.4800.520",,807515,0.075,60750,0,0.00,NDFoodBank,http://www.facebook.com/GreatPlainsFoodBank,http://www.facebook.com/GreatPlainsFoodBankNDFoodBankhttp://www.greatplainsfoodbank.org/get-involved/donate/https://secure.feedingamerica.org/site/SPageServer?pagename=GSNAP_Survey&s_src=X17YFARGO,http://help.feedingamerica.org/images_logos/FoodBankLogo_220_275w.jpghttps://secure.feedingamerica.org/images_logos/FoodBankLogo_220_275w.jpg,https://www.greatplainsfoodbank.org/get-involved/volunteer/,JoAnn Matthews,jmatthews@lssnd.org,701.476.9102,          ,19300,0.104,0.580,0.420,163,701.232.6219,701.232.3871,MBR,North,false,www.greatplainsfoodbank.org/,,,,,,1280550610422340true,,FB,"2008-10-10T00:00:002018-10-26T11:57:45.483175SteveSellent Steve   SellentSellent, Steve  MaleChief Executive Officer7012326219          701.232.6219701.232.3871ssellent@greatplainsfoodbank.org220","2008-10-10T00:00:002018-10-26T11:57:45.483385MarciaPaulson Marcia   PaulsonPaulson, Marcia  MaleChief Development Officer7014769101          701.476.9101701.232.3871mpaulson@greatplainsfoodbank.org220"
