rowid,OrganizationID,FullName,AgencyURL,MailAddress,BeginDt,EndDt,UpdateDt,UpdateUserID,ListFipsCounty,ListPDOs,POP_COUNT,FI_AGGREGATE,PUBLIC_FI,WT_ANNUAL_DOLLARS,COST_PER_MEAL,Twitter,FaceBook,SocialUrls,LogoUrls,VolunteerURL,VolunteerCoord,VolunteerEmail,VolunteerPhone,VolunteerPhoneExtension,CHILD_FI_COUNT,CHILD_FI_PCT,CHILD_FI_BELOW_PCT,CHILD_FI_ABOVE_PCT,EntityID,Phone,Fax,Type,Region,DistributionFlag,URL,DemographicStats,OperationsStats,FoodDistributionProgStats,ClientSupportProgStats,NationalProgStats,PoundageStats,AgenciesServedStats,SubType,ED,MediaContact
8,151,Food Bank of Northeast Arkansas,http://foodbankofnea.org/need-food/,0001-01-01T00:00:000001-01-01T00:00:00122-90.648009735.80392873414 One PlaceP.O. Box 2097JonesboroAR72402    72402,2008-04-04T14:46:54,,2017-02-10T09:17:37.717,,05005BAXTERAR410930.13957201.300SNAP1.850Other Nutrition Program0.4600.2300.31030220003.100.22316100.7800.22005009BOONEAR372120.14654201.300SNAP1.850Other Nutrition Program0.5500.2200.23023910002.590.23419800.8400.16005021CLAYAR151900.17326301.300SNAP1.850Other Nutrition Program0.6100.1700.22011740002.610.2699000.8500.15005031CRAIGHEADAR1042460.172179801.300SNAP1.850Other Nutrition Program0.5400.1300.33084110002.740.22658500.6600.34005037CROSSAR171640.18531701.300SNAP1.850Other Nutrition Program0.6100.1800.22015010002.770.2399900.7500.26005049FULTONAR120920.16520001.300SNAP1.850Other Nutrition Program0.6200.1400.2409810002.880.2836900.7500.25005055GREENEAR441970.15166701.300SNAP1.850Other Nutrition Program0.5000.1700.33030250002.660.23224900.7100.29005065IZARDAR135210.15821301.300SNAP1.850Other Nutrition Program0.5100.1800.31010700002.940.2666500.8100.19005067JACKSONAR174290.20435501.300SNAP1.850Other Nutrition Program0.5400.1400.32016920002.790.29710500.8000.20005075LAWRENCEAR167770.16127101.300SNAP1.850Other Nutrition Program0.5800.1200.29012830002.770.2308600.6800.32005089MARIONAR163740.15325101.300SNAP1.850Other Nutrition Program0.5800.2100.21012560002.930.2567500.8900.11005093MISSISSIPPIAR435340.233101601.300SNAP1.850Other Nutrition Program0.6300.1800.18048400002.790.28232700.7600.24005101NEWTONAR78980.14211201.300SNAP1.850Other Nutrition Program0.6300.2100.1705510002.880.2303600.8700.13005111POINSETTAR240980.17642401.300SNAP1.850Other Nutrition Program0.6100.1700.22018940002.620.26815400.8300.17005121RANDOLPHAR175140.16528901.300SNAP1.850Other Nutrition Program0.5900.1600.25013550002.750.25310200.7200.28005123ST. FRANCISAR266880.25768601.300SNAP1.850Other Nutrition Program0.6000.1500.25031660002.700.28316900.6600.34005129SEARCYAR79250.15111901.300SNAP1.850Other Nutrition Program0.6000.2400.1605800002.860.2253601.0000.00005135SHARPAR170410.17429701.300SNAP1.850Other Nutrition Program0.7100.1600.14014480002.860.27710100.9400.06005137STONEAR124430.17221401.300SNAP1.850Other Nutrition Program0.7200.0900.19010770002.950.2797000.8800.13005147WOODRUFFAR67630.21914801.300SNAP1.850Other Nutrition Program0.6400.0700.2907220002.860.2673900.6100.390,122626Food Bank of North Central Arkansas1042 Highland CircleMountain HomeAR72653QuickJeff                                   directorfbnca@centurytel.nethttp://www.foodbanknca.org/05005BaxterAR0000000000000005009BooneAR0000000000000005049FultonAR0000000000000005065IzardAR0000000000000005089MarionAR0000000000000005101NewtonAR0000000000000005129SearcyAR0000000000000005135SharpAR0000000000000005137StoneAR00000000000000870.499.7565870.499.3500,499199,0.175,87540,0,0.00,foodbankofnea,http://www.facebook.com/FoodBankofNEA/?fref=ts,http://www.facebook.com/FoodBankofNEA/?fref=tsfoodbankofneahttp://foodbankofnea.org/donate-now/,http://help.feedingamerica.org/images_logos/FoodBankLogo_151_275w.jpghttps://secure.feedingamerica.org/images_logos/FoodBankLogo_151_275w.jpg,http://foodbankofnea.org/volunteer/,Judy Becker -Agency Relations Coordinator,jbecker@foodbankofnea.org,   .   .    ,          ,28160,0.249,0.760,0.240,122,870.932.3663,870.933.6639,MBR,North,false,www.foodbankofnea.org,,,,,,84479096986606true,,FB,"2008-10-10T00:00:002017-02-10T09:17:37.73765ChristieJordan Christie   JordanJordan, Christie  MaleExecutive Director8709323663          870.932.3663870.933.6639cjordan@foodbankofnea.org151","2008-10-10T00:00:002017-02-10T09:17:37.737275ChristieJordan Christie   JordanJordan, Christie  MaleExecutive Director8709323663          870.932.3663870.933.6639cjordan@foodbankofnea.org151"
148,62,Regional Food Bank of Oklahoma,https://www.regionalfoodbank.org/get-help,0001-01-01T00:00:000001-01-01T00:00:0058-97.613735.43033355 S. PurduePO Box 270968Oklahoma CityOK73179    73179,2008-04-04T14:46:54,,2020-01-14T17:07:45.07,,40003ALFALFAOK58770.1257401.300SNAP1.850Other Nutrition Program0.3500.1700.4803770002.980.1932300.6500.35040005ATOKAOK138990.17123701.300SNAP1.850Other Nutrition Program0.5400.1200.33011870002.930.2477700.7300.27040007BEAVEROK54450.0965201.300SNAP1.850Other Nutrition Program0.5100.3100.1802620002.950.1782500.7900.21040009BECKHAMOK229710.13330601.300SNAP1.850Other Nutrition Program0.4900.2000.30016600003.180.19111100.6500.35040011BLAINEOK96800.13112701.300SNAP1.850Other Nutrition Program0.4900.1200.3906650003.070.2074500.7600.24040013BRYANOK450680.15971501.300SNAP1.850Other Nutrition Program0.5700.1800.26037280003.060.22323500.7300.27040015CADDOOK294370.15645901.300SNAP1.850Other Nutrition Program0.5700.1500.28023620003.020.23417400.7100.29040017CANADIANOK1329220.113150201.300SNAP1.850Other Nutrition Program0.3500.1400.52079870003.120.17661800.4800.52040019CARTEROK484070.15876601.300SNAP1.850Other Nutrition Program0.5100.1600.33036960002.830.21826900.6600.35040025CIMARRONOK22210.1142501.300SNAP1.850Other Nutrition Program0.5700.2900.1301320003.090.1921000.9100.09040027CLEVELANDOK2740240.139381001.300SNAP1.850Other Nutrition Program0.4000.1400.460198810003.060.186113500.5200.48040029COALOK56660.1689501.300SNAP1.850Other Nutrition Program0.5400.1400.3204770002.940.2493500.6200.38040031COMANCHEOK1230660.175215401.300SNAP1.850Other Nutrition Program0.4900.1600.350103740002.820.22065200.6100.39040033COTTONOK60000.1388301.300SNAP1.850Other Nutrition Program0.5000.2200.2804170002.950.1942700.6600.34040039CUSTEROK291690.13739901.300SNAP1.850Other Nutrition Program0.5600.1800.26022400003.290.19213900.7200.28040043DEWEYOK49040.1437001.300SNAP1.850Other Nutrition Program0.6400.0500.3203880003.240.2333100.8000.20040045ELLISOK41020.1395701.300SNAP1.850Other Nutrition Program0.5700.1600.2703230003.320.2132100.7800.22040047GARFIELDOK624210.13886401.300SNAP1.850Other Nutrition Program0.5000.1700.33042670002.890.20132700.6700.33040049GARVINOK277510.15342401.300SNAP1.850Other Nutrition Program0.5600.1900.25022250003.070.21515000.7400.27040051GRADYOK543510.13372201.300SNAP1.850Other Nutrition Program0.4600.1500.39039210003.180.20226900.6100.39040053GRANTOK44580.1185301.300SNAP1.850Other Nutrition Program0.3900.1600.4502580002.850.1882000.5600.44040055GREEROK60180.1639801.300SNAP1.850Other Nutrition Program0.5500.1400.3205290003.160.2292700.7200.28040057HARMONOK27580.1243401.300SNAP1.850Other Nutrition Program0.5900.1900.2301830003.160.1831200.5800.42040059HARPEROK38430.1023901.300SNAP1.850Other Nutrition Program0.4900.2500.2602160003.240.1972000.7200.28040063HUGHESOK135190.17123101.300SNAP1.850Other Nutrition Program0.5100.1800.32011390002.890.2547500.7500.25040065JACKSONOK255740.14537001.300SNAP1.850Other Nutrition Program0.5300.1900.28019500003.090.21213900.6000.40040067JEFFERSONOK62700.16310201.300SNAP1.850Other Nutrition Program0.6200.2000.1805120002.940.2533700.8200.18040069JOHNSTONOK110390.16117801.300SNAP1.850Other Nutrition Program0.5900.1900.2208710002.870.2356400.8400.16040071KAYOK451730.15972001.300SNAP1.850Other Nutrition Program0.5300.1700.30033100002.690.23827000.7200.28040073KINGFISHEROK155100.09715101.300SNAP1.850Other Nutrition Program0.4000.2400.3607830003.040.1767400.5900.41040075KIOWAOK91270.17315801.300SNAP1.850Other Nutrition Program0.5900.1300.2807960002.950.2635700.6800.32040081LINCOLNOK347590.14249401.300SNAP1.850Other Nutrition Program0.4900.1900.33025330003.000.21618400.6900.31040083LOGANOK453260.13762001.300SNAP1.850Other Nutrition Program0.4500.1600.39032760003.100.19421000.6300.37040085LOVEOK98430.11311101.300SNAP1.850Other Nutrition Program0.4900.2800.2305630002.970.1854600.7300.27040087MC CLAINOK379190.11543601.300SNAP1.850Other Nutrition Program0.3600.1500.48023240003.120.18017600.4800.52040093MAJOROK77300.1229501.300SNAP1.850Other Nutrition Program0.4200.2000.3804910003.030.1913800.6100.39040095MARSHALLOK162260.12820801.300SNAP1.850Other Nutrition Program0.5600.2000.25010300002.900.2148100.7200.28040099MURRAYOK137970.14219601.300SNAP1.850Other Nutrition Program0.4600.1600.3809580002.860.2046600.6000.40040103NOBLEOK114210.13315201.300SNAP1.850Other Nutrition Program0.4100.1800.4107660002.950.1855100.5800.42040107OKFUSKEEOK121600.19123301.300SNAP1.850Other Nutrition Program0.6000.1300.27011880002.990.2567300.8200.18040109OKLAHOMAOK7742030.1601235401.300SNAP1.850Other Nutrition Program0.5200.1600.330630920002.990.215427900.6200.38040117PAWNEEOK164480.15124901.300SNAP1.850Other Nutrition Program0.5100.1900.30013350003.140.2258900.6900.31040119PAYNEOK806340.195157501.300SNAP1.850Other Nutrition Program0.5600.0900.35080480002.990.21733900.6500.36040123PONTOTOCOK382890.15860701.300SNAP1.850Other Nutrition Program0.4900.1600.36027990002.700.21919900.6500.35040125POTTAWATOMIEOK716140.156111801.300SNAP1.850Other Nutrition Program0.5000.1600.34054910002.880.22338900.6700.33040129ROGER MILLSOK37340.1445401.300SNAP1.850Other Nutrition Program0.5200.1000.3903000003.260.2312200.5800.42040133SEMINOLEOK252460.18246101.300SNAP1.850Other Nutrition Program0.5800.1600.26022890002.910.26116800.7100.29040137STEPHENSOK442930.15668901.300SNAP1.850Other Nutrition Program0.4900.1700.34037340003.180.23124200.6500.35040139TEXASOK214090.09420201.300SNAP1.850Other Nutrition Program0.5800.1600.27010300002.990.18711000.5600.44040141TILLMANOK75910.13910601.300SNAP1.850Other Nutrition Program0.6100.1500.2405290002.930.2234100.6300.37040149WASHITAOK115500.13515601.300SNAP1.850Other Nutrition Program0.4500.1400.4108580003.220.2146300.5300.47040151WOODSOK91320.13412301.300SNAP1.850Other Nutrition Program0.4300.1400.4306270002.990.1793200.5200.48040153WOODWARDOK211400.12426101.300SNAP1.850Other Nutrition Program0.3900.2000.41014290003.210.19410500.6000.400,,2365134,0.150,355750,0,0.00,rfbo,http://www.facebook.com/regionalfoodbank,http://www.facebook.com/regionalfoodbankrfbohttps://secure3.convio.net/rfbo/site/Donation2?df_id=1320&1320.donation=form1,http://help.feedingamerica.org/images_logos/FoodBankLogo_62_275w.jpghttps://secure.feedingamerica.org/images_logos/FoodBankLogo_62_275w.jpg,http://www.regionalfoodbank.org/fight-hunger/volunteer,Kenneth McDonald,kmcdonald@regionalfoodbank.org,405.600.3134,          ,121710,0.209,0.630,0.380,58,405.972.1111,405.688.6447,MBR,North,false,www.regionalfoodbank.org,,,,,,4685972937990767false,,FB,"2008-10-10T00:00:002020-01-14T17:07:45.087204DebBunting Deb   BuntingBunting, Deb  MaleInterim CEO4059721111          405.972.1111405.688.6447dbunting@regionalfoodbank.org62","2008-10-10T00:00:002020-01-14T17:07:45.087414CathyNestlen Cathy   NestlenNestlen, Cathy  MaleDirector of Strategic Communications4056047115          405.604.7115405.688.6447cnestlen@rfbo.org62"
109,103,MANNA FoodBank,http://www.mannafoodbank.org/where-to-get-help/,0001-01-01T00:00:000001-01-01T00:00:0093-82.49819135.577196627 Swannanoa River RdAshevilleNC28805    28805,2008-04-04T14:46:54,,2016-04-27T10:50:07.59,,"37011AVERYNC175350.12221402.000SNAP, Other Nutrition Programs2.000SNAP, Other Nutrition Programs0.7400.0000.26010700002.930.1935200.7700.23037021BUNCOMBENC2522680.123311002.000SNAP, Other Nutrition Programs2.000SNAP, Other Nutrition Programs0.7100.0000.300156070002.940.18488900.7300.27037039CHEROKEENC274630.12835202.000SNAP, Other Nutrition Programs2.000SNAP, Other Nutrition Programs0.7700.0000.23017800002.960.22410800.8700.13037043CLAYNC107530.13114102.000SNAP, Other Nutrition Programs2.000SNAP, Other Nutrition Programs0.7800.0000.2207140002.970.2284400.9500.05037075GRAHAMNC86070.14312302.000SNAP, Other Nutrition Programs2.000SNAP, Other Nutrition Programs0.8500.0000.1506320003.010.2494500.9300.07037087HAYWOODNC598540.12675502.000SNAP, Other Nutrition Programs2.000SNAP, Other Nutrition Programs0.6800.0000.32038350002.980.22224400.7700.23037089HENDERSONNC1121560.106118402.000SNAP, Other Nutrition Programs2.000SNAP, Other Nutrition Programs0.7400.0000.26058000002.870.18239800.7600.24037099JACKSONNC417250.14761502.000SNAP, Other Nutrition Programs2.000SNAP, Other Nutrition Programs0.6400.0000.36031050002.960.22816400.6500.35037111MC DOWELLNC450690.13560902.000SNAP, Other Nutrition Programs2.000SNAP, Other Nutrition Programs0.7900.0000.21030080002.890.22220800.8000.20037113MACONNC341600.12743502.000SNAP, Other Nutrition Programs2.000SNAP, Other Nutrition Programs0.7300.0000.27021810002.940.22914700.7900.21037115MADISONNC213470.13128002.000SNAP, Other Nutrition Programs2.000SNAP, Other Nutrition Programs0.7000.0000.30014380003.010.2168400.8200.18037121MITCHELLNC151550.12118402.000SNAP, Other Nutrition Programs2.000SNAP, Other Nutrition Programs0.7000.0000.3009660003.080.2166000.6000.40037149POLKNC204340.11222902.000SNAP, Other Nutrition Programs2.000SNAP, Other Nutrition Programs0.6900.0000.31012720003.260.1916700.7100.29037173SWAINNC142080.14220202.000SNAP, Other Nutrition Programs2.000SNAP, Other Nutrition Programs0.8600.0000.14010410003.020.2497900.8100.19037175TRANSYLVANIANC332910.12642002.000SNAP, Other Nutrition Programs2.000SNAP, Other Nutrition Programs0.7400.0000.26023260003.250.23212600.8500.15037199YANCEYNC176050.13523702.000SNAP, Other Nutrition Programs2.000SNAP, Other Nutrition Programs0.8200.0000.18012020002.970.2167200.9600.040",,731630,0.124,90900,0,0.00,MANNAFoodBank,http://www.facebook.com/MANNAFoodBank,http://www.facebook.com/MANNAFoodBankMANNAFoodBankhttp://mannafoodbank.org/donate-money/https://secure.feedingamerica.org/site/SPageServer?pagename=GSNAP_Survey&s_src=X15YASHEV,http://help.feedingamerica.org/images_logos/FoodBankLogo_103_275w.jpghttps://secure.feedingamerica.org/images_logos/FoodBankLogo_103_275w.jpg,http://mannafoodbank.org/volunteer,,,   .   .    ,          ,27870,0.202,0.770,0.230,93,828.299.3663,828.299.3664,MBR,North,true,www.mannafoodbank.org,,,,,,1682630513488354true,,FB,"2008-10-10T00:00:002016-04-27T10:50:07.61165HannahRandall_Hannah _ RandallRandall, Hannah _MaleExecutive Director8282993663          828.299.3663828.299.3664hrandall@mannafoodbank.org103","2008-10-10T00:00:002016-04-27T10:50:07.61375KaraIrani Kara   IraniIrani, Kara  MaleCommunications & Marketing Director8282993663          828.299.3663828.299.3664kirani@mannafoodbank.org103"
104,187,Southeast Missouri Food Bank,https://www.semofoodbank.org/pantry-locator/,0001-01-01T00:00:000001-01-01T00:00:00143-89.538118736.9082684600 State Highway HPO Box 190SikestonMO63801    63801,2008-04-04T14:46:54,,2019-07-31T09:38:38.093,,29017BOLLINGERMO123470.14017201.300SNAP1.850Other Nutrition Program0.6200.1200.2708300002.830.2075700.7000.30029023BUTLERMO428260.16670901.300SNAP1.850Other Nutrition Program0.6600.1500.20031490002.600.21321300.7700.23029031CAPE GIRARDEAUMO780130.147114801.300SNAP1.850Other Nutrition Program0.5200.1200.37054260002.770.17429100.6300.38029035CARTERMO62550.1408801.300SNAP1.850Other Nutrition Program0.5500.2200.2304010002.670.1732700.6900.31029069DUNKLINMO309050.18958401.300SNAP1.850Other Nutrition Program0.7100.1400.15024430002.450.24719800.7700.23029123MADISONMO122260.14617901.300SNAP1.850Other Nutrition Program0.6600.2000.1408560002.800.1925300.9400.06029133MISSISSIPPIMO139160.21730101.300SNAP1.850Other Nutrition Program0.6900.0800.23013300002.590.2708300.7800.22029143NEW MADRIDMO180300.19735401.300SNAP1.850Other Nutrition Program0.7000.1200.19016310002.700.24610400.7900.22029155PEMISCOTMO173440.23240201.300SNAP1.850Other Nutrition Program0.7400.1300.13018170002.650.25611800.8000.20029157PERRYMO191350.10019201.300SNAP1.850Other Nutrition Program0.5200.2500.2309100002.780.1416500.8700.13029179REYNOLDSMO63610.1358601.300SNAP1.850Other Nutrition Program0.5800.2200.2104240002.890.1872500.7300.28029181RIPLEYMO138070.16022101.300SNAP1.850Other Nutrition Program0.6800.1600.1609960002.640.2237100.7700.24029186SAINTE GENEVIEVEMO178820.13023301.300SNAP1.850Other Nutrition Program0.5300.1000.38011610002.920.1987900.6600.34029201SCOTTMO388580.16262901.300SNAP1.850Other Nutrition Program0.5900.1700.24028350002.640.21219600.7500.25029207STODDARDMO296340.14643301.300SNAP1.850Other Nutrition Program0.5300.2200.25021960002.970.19212400.8100.19029223WAYNEMO133690.15620901.300SNAP1.850Other Nutrition Program0.6800.1600.1609770002.740.2196300.9200.080,,370908,0.160,59400,0,0.00,semofoodbank,http://www.facebook.com/SoutheastMOFoodBank,http://www.facebook.com/SoutheastMOFoodBanksemofoodbankhttps://secure2.convio.net/smfb/site/Donation2?df_id=1620&mfc_pref=T&1620.donation=form1https://secure.feedingamerica.org/site/SPageServer?pagename=GSNAP_Survey&s_src=X14YSIKES,http://help.feedingamerica.org/images_logos/FoodBankLogo_187_275w.jpghttps://secure.feedingamerica.org/images_logos/FoodBankLogo_187_275w.jpg,https://www.semofoodbank.org/get-involved/volunteer/, Patricia Krueger  Volunteer Coordinator,,573.651.0400,          ,17670,0.207,0.760,0.240,143,855.703.3663,573.651.0405,MBR,North,false,www.semofoodbank.org,,,,,,115151449248359true,,FB,"2008-10-10T00:00:002019-07-31T09:38:38.11154JoeyKeys Joey   KeysKeys, Joey  MalePresident & Chief Executive Officer5736510400          573.651.0400573.651.0405jkeys@semofoodbank.org187","2008-10-10T00:00:002019-07-31T09:38:38.11364JenniferWood Jennifer   WoodWood, Jennifer  MaleChief Advancement Officer6602212978          660.221.2978573.651.0405jewood@semofoodbank.org187"
123,1,Roadrunner Food Bank,https://www.rrfb.org/find-help/find-food/,0001-01-01T00:00:000001-01-01T00:00:001-106.59966835.1463845840 Office Blvd NEAlbuquerqueNM87109    87109,2008-04-04T14:46:54,,2020-02-06T15:52:31.6,,35001BERNALILLONM6748550.1491003501.650SNAP1.850Other Nutrition Program0.6800.0200.300517050003.020.225343800.6700.33035003CATRONNM35470.1876601.650SNAP1.850Other Nutrition Program0.6100.0500.3403280002.910.2841500.9100.09035005CHAVESNM654540.14896901.650SNAP1.850Other Nutrition Program0.8000.0300.17048190002.910.24643600.7400.26035006CIBOLANM270490.19853501.650SNAP1.850Other Nutrition Program0.7500.0400.21025290002.770.30419800.8200.18035007COLFAXNM125220.16320401.650SNAP1.850Other Nutrition Program0.7800.0100.21011600003.330.2596100.9000.10035009CURRYNM502830.18090401.650SNAP1.850Other Nutrition Program0.7900.0200.19048810003.160.25133900.7900.21035011DE BACANM20160.1603201.650SNAP1.850Other Nutrition Program0.8400.0700.1001650003.010.2081000.8600.15035013DONA ANANM2138490.155331101.650SNAP1.850Other Nutrition Program0.8400.0100.150169950003.010.271147000.7500.25035015EDDYNM567930.13174101.650SNAP1.850Other Nutrition Program0.6300.0700.31039700003.140.21231700.6800.32035017GRANTNM283820.15343401.650SNAP1.850Other Nutrition Program0.6900.0500.26023890003.230.25014900.7300.27035019GUADALUPENM44260.0944201.650SNAP1.850Other Nutrition Program0.7100.0500.2402200003.070.2061700.5000.50035021HARDINGNM5460.167901.650SNAP1.850Other Nutrition Program0.7200.0600.230500003.260.278300.7600.24035023HIDALGONM44460.1496601.650SNAP1.850Other Nutrition Program0.7900.0300.1803320002.950.2592700.7700.23035025LEANM695050.13392701.650SNAP1.850Other Nutrition Program0.6600.0300.31048970003.100.22046100.6300.37035027LINCOLNNM194970.15430001.650SNAP1.850Other Nutrition Program0.6500.0500.30015470003.020.2147700.7400.26035028LOS ALAMOSNM180310.12722901.650SNAP1.850Other Nutrition Program0.2600.0300.72012750003.260.1717100.2900.71035029LUNANM243190.20750401.650SNAP1.850Other Nutrition Program0.8500.0500.10025630002.980.33421500.8600.14035031MC KINLEYNM728490.260189201.650SNAP1.850Other Nutrition Program0.8300.0200.15088400002.740.33572400.8600.14035033MORANM46050.1145301.650SNAP1.850Other Nutrition Program1.0000.0000.0003030003.350.2422000.9900.01035035OTERONM651300.179116801.650SNAP1.850Other Nutrition Program0.6600.0400.30062660003.140.25940000.7500.25035037QUAYNM84470.16814201.650SNAP1.850Other Nutrition Program0.9000.0900.0107340003.030.2715100.8500.15035039RIO ARRIBANM394550.13251901.650SNAP1.850Other Nutrition Program0.8000.0200.18026350002.970.24723300.7700.23035041ROOSEVELTNM193130.18836401.650SNAP1.850Other Nutrition Program0.7800.0200.20018540002.980.26712700.7500.26035043SANDOVALNM1388150.142197401.650SNAP1.850Other Nutrition Program0.5800.0500.380104640003.110.22074100.6200.38035045SAN JUANNM1282210.196251701.650SNAP1.850Other Nutrition Program0.6600.0400.310120140002.800.26693800.7700.24035047SAN MIGUELNM282030.14641301.650SNAP1.850Other Nutrition Program0.8100.0100.18021910003.110.27115400.7000.30035049SANTA FENM1475140.124183101.650SNAP1.850Other Nutrition Program0.6500.0300.320104990003.360.20959100.6800.32035051SIERRANM112540.19021401.650SNAP1.850Other Nutrition Program0.7300.0500.22010580002.900.2785100.8000.20035053SOCORRONM170980.16428001.650SNAP1.850Other Nutrition Program0.7500.0400.21014440003.020.26610600.7900.21035055TAOSNM328090.15049101.650SNAP1.850Other Nutrition Program0.8100.0200.17030390003.630.24915400.8600.14035057TORRANCENM155340.18528801.650SNAP1.850Other Nutrition Program0.7800.0400.18015070003.070.2728800.9500.05035059UNIONNM42160.1415901.650SNAP1.850Other Nutrition Program0.6200.0800.3002990002.970.2312000.7200.28035061VALENCIANM758450.134101401.650SNAP1.850Other Nutrition Program0.7700.0500.18050070002.890.24144600.8000.200,1500The Community Pantry1130 E. Hasler Valley RoadGallupNM87305PerezAlice                                   coo@thecommunitypantry.orgTBigbee@FeedingAmerica.orghttp://thecommunitypantry.org/505.726.8068505.726.90221501The Food Depot1222 A Siler Rd.Santa FeNM87507HooperSherry                                   director@thefooddepot.orgTBigbee@FeedingAmerica.orghttp://www.thefooddepot.org505.471.1633505.471.20251503Food Bank of Eastern New Mexico2217 East Brady St.ClovisNM88101SpragueDianna                                   foodbank@plateautel.netTBigbee@FeedingAmerica.orghttp://www.fbenm.org575.763.6130505.763.22401504ECHO Inc.401 S. CommercialFarmingtonNM87401SchilzLinda                                   info@echoinc.orgTBigbee@FeedingAmerica.orghttp://www.echoinc.org505.325.8222505.326.5025,2088070,0.155,324000,0,0.00,RoadrunnerFdBnk,http://www.facebook.com/roadrunner.food.bank,http://www.facebook.com/roadrunner.food.bankRoadrunnerFdBnkhttps://www.rrfb.org/give/give-funds/https://secure.feedingamerica.org/site/SPageServer?pagename=GSNAP_Survey&s_src=X16YALBUQ,http://help.feedingamerica.org/images_logos/FoodBankLogo_1_275w.jpghttps://secure.feedingamerica.org/images_logos/FoodBankLogo_1_275w.jpg,https://www.rrfb.org/give/give-time/,Christina Berlin,christina@rrfb.org,505.349.8825,          ,118030,0.241,0.730,0.270,1,505.247.2052,505.242.6471,MBR,North,false,www.rrfb.org,,,,,,3797270731196881true,,FB,"2008-10-10T00:00:002020-02-06T15:52:31.787174MagStrittmatter Mag   StrittmatterStrittmatter, Mag  MalePresident and CEO5052472052          505.247.2052505.242.6471mag.strittmatter@rrfb.org1","2008-10-10T00:00:002020-02-06T15:52:31.787384SonyaWarwick Sonya   WarwickWarwick, Sonya  MaleCommunications Officer5053498682          505.349.8682505.242.6471sonya@rrfb.org1"
