rowid,OrganizationID,FullName,AgencyURL,MailAddress,BeginDt,EndDt,UpdateDt,UpdateUserID,ListFipsCounty,ListPDOs,POP_COUNT,FI_AGGREGATE,PUBLIC_FI,WT_ANNUAL_DOLLARS,COST_PER_MEAL,Twitter,FaceBook,SocialUrls,LogoUrls,VolunteerURL,VolunteerCoord,VolunteerEmail,VolunteerPhone,VolunteerPhoneExtension,CHILD_FI_COUNT,CHILD_FI_PCT,CHILD_FI_BELOW_PCT,CHILD_FI_ABOVE_PCT,EntityID,Phone,Fax,Type,Region,DistributionFlag,URL,DemographicStats,OperationsStats,FoodDistributionProgStats,ClientSupportProgStats,NationalProgStats,PoundageStats,AgenciesServedStats,SubType,ED,MediaContact
51,5,Golden Harvest Food Bank,https://goldenharvest.org/get-help/find-an-agency/,0001-01-01T00:00:000001-01-01T00:00:005-82.06007733.4498743310 Commerce DriveAugustaGA30909441730909-4417,2008-04-04T14:46:54,,2020-01-03T15:35:30.463,,13033BURKEGA226450.21248101.300SNAP1.850Other Nutrition Program0.6700.1400.19022060002.690.28516900.7400.26013073COLUMBIAGA1437230.091130501.300SNAP1.850Other Nutrition Program0.3600.1300.51066490002.990.16260400.4600.55013105ELBERTGA192880.16131101.300SNAP1.850Other Nutrition Program0.6200.1600.22015880002.990.2349900.7000.30013107EMANUELGA225020.19644201.300SNAP1.850Other Nutrition Program0.6700.1500.18019440002.580.27615700.8300.17013125GLASCOCKGA30270.1083301.300SNAP1.850Other Nutrition Program0.4800.3300.2001540002.730.1761201.0000.00013133GREENEGA167320.16227101.300SNAP1.850Other Nutrition Program0.6200.1600.21014870003.220.2347600.8000.20013141HANCOCKGA86670.23720601.300SNAP1.850Other Nutrition Program0.5000.0800.41010150002.890.2963700.7000.30013163JEFFERSONGA159540.21434201.300SNAP1.850Other Nutrition Program0.6500.2000.15016930002.900.26910300.7500.25013165JENKINSGA89290.19917801.300SNAP1.850Other Nutrition Program0.7400.1500.1108800002.900.2776000.6900.31013167JOHNSONGA98000.16816501.300SNAP1.850Other Nutrition Program0.5500.1900.2607910002.810.2404800.6400.36013181LINCOLNGA77680.16913101.300SNAP1.850Other Nutrition Program0.5600.2200.2206620002.960.2513800.7400.26013189MC DUFFIEGA214880.19842501.300SNAP1.850Other Nutrition Program0.6000.1000.30019480002.690.27315500.6600.34013237PUTNAMGA214300.13729401.300SNAP1.850Other Nutrition Program0.5400.2200.25014060002.800.2149000.9200.09013245RICHMONDGA2015680.214431301.300SNAP1.850Other Nutrition Program0.6000.1700.240215260002.920.248117100.7200.28013251SCREVENGA140370.18826401.300SNAP1.850Other Nutrition Program0.6600.2100.14013330002.960.2567900.8800.12013265TALIAFERROGA18440.2294201.300SNAP1.850Other Nutrition Program0.6700.1700.1602280003.180.282800.6600.34013301WARRENGA54100.22011901.300SNAP1.850Other Nutrition Program0.6300.1700.2105630002.770.2452800.7100.29013303WASHINGTONGA205060.20842701.300SNAP1.850Other Nutrition Program0.6000.1400.27020030002.750.25111600.7500.25013317WILKESGA99050.19219001.300SNAP1.850Other Nutrition Program0.6500.2000.15010290003.170.2745600.8200.19045003AIKENSC1657070.125207501.300SNAP1.850Other Nutrition Program0.5900.1700.24097250002.750.18367000.7400.26045005ALLENDALESC94020.24122701.300SNAP1.850Other Nutrition Program0.6400.2200.14010790002.780.2694900.6200.38045009BAMBERGSC148420.20730701.300SNAP1.850Other Nutrition Program0.6400.1500.21014790002.820.2407200.7000.30045011BARNWELLSC217880.19342101.300SNAP1.850Other Nutrition Program0.6600.1300.22019280002.680.24012900.6700.33045037EDGEFIELDSC266200.13535901.300SNAP1.850Other Nutrition Program0.5100.1600.33017800002.910.1799000.6800.32045065MC CORMICKSC96940.16616101.300SNAP1.850Other Nutrition Program0.4700.2000.3307730002.820.2362900.5800.420,,1309594,0.149,195370,0,0.00,ghfbEndHunger,http://www.facebook.com/GoldenHarvestFoodBank,http://www.facebook.com/GoldenHarvestFoodBankghfbEndHungerhttps://goldenharvest.org/donate/?oper=donate,http://help.feedingamerica.org/images_logos/FoodBankLogo_5_275w.jpghttps://secure.feedingamerica.org/images_logos/FoodBankLogo_5_275w.jpg,http://www.goldenharvest.org/GetInvolved/Volunteer.aspx,Agency Representative ,krobinson@goldenharvest.org,706.736.1199,          ,60760,0.206,0.700,0.300,5,706.736.1199,706.736.1375,MBR,North,true,www.goldenharvest.org,,,,,,1513376612379219true,,FB,"2008-10-10T00:00:002020-01-03T15:35:30.477109AmyBreitmann Amy   BreitmannBreitmann, Amy  MaleExecutive Director7067361199          706.736.1199706.736.1375ABreitmann@goldenharvest.org5","2008-10-10T00:00:002020-01-03T15:35:30.48319ChristinaAlexander Christina   AlexanderAlexander, Christina  MaleCommunications Coordinator7067361199230       706.736.1199 X230       706.736.1375calexander@goldenharvest.org5"
113,70,Food Bank of Central & Eastern North Carolina,http://content.foodbankcenc.org/about/zip.asp,0001-01-01T00:00:000001-01-01T00:00:0064-78.615231635.80437241924 Capital BoulevardRaleighNC27604    27604,2008-04-04T14:46:54,,2017-02-10T09:41:33.473,,"37019BRUNSWICKNC1225860.132161602.000SNAP, Other Nutrition Programs2.000SNAP, Other Nutrition Programs0.6800.0000.32092490003.350.21945000.7700.23037031CARTERETNC686990.12183102.000SNAP, Other Nutrition Programs2.000SNAP, Other Nutrition Programs0.6600.0000.35047700003.360.19624600.6900.31037037CHATHAMNC683640.11074902.000SNAP, Other Nutrition Programs2.000SNAP, Other Nutrition Programs0.6700.0000.33042780003.350.18526100.6900.32037047COLUMBUSNC565890.185104702.000SNAP, Other Nutrition Programs2.000SNAP, Other Nutrition Programs0.7900.0000.22048680002.720.24430300.7700.23037049CRAVENNC1033740.151156102.000SNAP, Other Nutrition Programs2.000SNAP, Other Nutrition Programs0.6900.0000.31083250003.130.21449500.7100.29037061DUPLINNC593500.15893902.000SNAP, Other Nutrition Programs2.000SNAP, Other Nutrition Programs0.9900.0000.01044250002.760.24135300.8800.12037063DURHAMNC3008650.165496002.000SNAP, Other Nutrition Programs2.000SNAP, Other Nutrition Programs0.6800.0000.330269850003.190.191124600.6200.38037065EDGECOMBENC540320.241130002.000SNAP, Other Nutrition Programs2.000SNAP, Other Nutrition Programs0.9300.0000.07060990002.750.26433000.8100.19037069FRANKLINNC638660.14894702.000SNAP, Other Nutrition Programs2.000SNAP, Other Nutrition Programs0.7900.0000.21046930002.900.20129100.8200.18037077GRANVILLENC585030.14685302.000SNAP, Other Nutrition Programs2.000SNAP, Other Nutrition Programs0.7200.0000.28042320002.910.18122200.7100.29037079GREENENC210590.17837502.000SNAP, Other Nutrition Programs2.000SNAP, Other Nutrition Programs0.7800.0000.23018780002.930.23610600.7400.26037083HALIFAXNC523000.238124402.000SNAP, Other Nutrition Programs2.000SNAP, Other Nutrition Programs0.8800.0000.12058890002.770.26429900.8000.20037085HARNETTNC1287530.150193502.000SNAP, Other Nutrition Programs2.000SNAP, Other Nutrition Programs0.7800.0000.220101430003.070.20772100.7500.25037101JOHNSTONNC1863080.122227002.000SNAP, Other Nutrition Programs2.000SNAP, Other Nutrition Programs0.7500.0000.250122230003.160.19193200.7000.30037103JONESNC97760.18618202.000SNAP, Other Nutrition Programs2.000SNAP, Other Nutrition Programs0.8400.0000.1609140002.940.2685100.7800.22037105LEENC598050.13581002.000SNAP, Other Nutrition Programs2.000SNAP, Other Nutrition Programs0.7800.0000.22037470002.710.20630900.7000.30037107LENOIRNC579340.194112202.000SNAP, Other Nutrition Programs2.000SNAP, Other Nutrition Programs0.8700.0000.13047990002.510.23330500.7400.27037125MOORENC941910.125117502.000SNAP, Other Nutrition Programs2.000SNAP, Other Nutrition Programs0.6600.0000.34066200003.300.19439000.6700.33037127NASHNC941250.179168302.000SNAP, Other Nutrition Programs2.000SNAP, Other Nutrition Programs0.7600.0000.24076400002.660.20844300.7200.28037129NEW HANOVERNC2198660.153336602.000SNAP, Other Nutrition Programs2.000SNAP, Other Nutrition Programs0.6600.0000.340183220003.190.20185100.6400.36037133ONSLOWNC1926850.146281602.000SNAP, Other Nutrition Programs2.000SNAP, Other Nutrition Programs0.7500.0000.250138510002.880.20395700.7500.25037135ORANGENC1418120.127180302.000SNAP, Other Nutrition Programs2.000SNAP, Other Nutrition Programs0.5800.0000.420122000003.970.15544200.5100.49037137PAMLICONC128030.14418402.000SNAP, Other Nutrition Programs2.000SNAP, Other Nutrition Programs0.7200.0000.2809890003.150.2274700.9000.10037141PENDERNC576300.13276202.000SNAP, Other Nutrition Programs2.000SNAP, Other Nutrition Programs0.6700.0000.33044800003.450.19124700.6700.33037145PERSONNC392400.16263502.000SNAP, Other Nutrition Programs2.000SNAP, Other Nutrition Programs0.7500.0000.25030660002.830.22218900.7600.24037147PITTNC1764840.201354002.000SNAP, Other Nutrition Programs2.000SNAP, Other Nutrition Programs0.7500.0000.250170180002.820.21783800.6700.33037153RICHMONDNC454470.19890102.000SNAP, Other Nutrition Programs2.000SNAP, Other Nutrition Programs0.8500.0000.15037770002.460.26327900.7900.21037163SAMPSONNC636640.159100902.000SNAP, Other Nutrition Programs2.000SNAP, Other Nutrition Programs0.9100.0000.09046690002.710.22936100.7900.22037165SCOTLANDNC354450.23382502.000SNAP, Other Nutrition Programs2.000SNAP, Other Nutrition Programs0.8300.0000.18038530002.740.28323400.7800.22037181VANCENC444200.21696102.000SNAP, Other Nutrition Programs2.000SNAP, Other Nutrition Programs0.9100.0000.10044880002.740.24325900.7700.23037183WAKENC10238110.1211241302.000SNAP, Other Nutrition Programs2.000SNAP, Other Nutrition Programs0.5800.0000.420690910003.260.164413200.5600.44037185WARRENNC201900.21242902.000SNAP, Other Nutrition Programs2.000SNAP, Other Nutrition Programs0.8200.0000.18021660002.960.2439100.7400.26037191WAYNENC1244960.176219002.000SNAP, Other Nutrition Programs2.000SNAP, Other Nutrition Programs0.8100.0000.190102100002.730.23569800.7400.26037195WILSONNC813790.197159902.000SNAP, Other Nutrition Programs2.000SNAP, Other Nutrition Programs0.8100.0000.19070670002.590.25248500.7400.260",,3939851,0.150,590320,0,0.00,FoodBankCENC,http://www.facebook.com/FoodBankCENC,http://www.facebook.com/FoodBankCENCFoodBankCENChttp://www.foodbankcenc.org/site/PageServer?pagename=donatehttps://secure.feedingamerica.org/site/SPageServer?pagename=GSNAP_Survey&s_src=X15YRALEI,http://help.feedingamerica.org/images_logos/FoodBankLogo_70_275w.jpghttps://secure.feedingamerica.org/images_logos/FoodBankLogo_70_275w.jpg,http://www.foodbankcenc.org/site/PageServer?pagename=getinvolved_volunteer,,RalVolCoord@foodbankcenc.org,919.865.3024,          ,178630,0.198,0.680,0.320,64,919.875.0707,919.875.0801,MBR,North,false,www.foodbankcenc.org,,,,,,7407452159904516true,,FB,"2008-10-10T00:00:002017-02-10T09:41:33.493169PeterWerbicki Peter   WerbickiWerbicki, Peter  MaleExecutive Director9198750707          919.875.0707919.875.0801pwerbicki@foodbankcenc.org70","2008-10-10T00:00:002017-02-10T09:41:33.497379JessicaWhichard Jessica   WhichardWhichard, Jessica  MaleMedia Contact9198750707          919.875.0707919.875.0801jwhichard@foodbankcenc.org70"
182,24,North Texas Food Bank,https://www.ntfb.org/FoodAssistance,0001-01-01T00:00:000001-01-01T00:00:0023-96.75954333.0040593677 Mapleshade LanePlanoTX75075    75075,2008-04-04T14:46:54,,2019-12-11T14:47:31.04,,48085COLLINTX9140750.1421300901.650SNAP1.850Other Nutrition Program0.3500.0400.620698370003.150.187459200.3800.62048113DALLASTX25522130.1724388301.650SNAP1.850Other Nutrition Program0.7400.0300.2402158440002.880.2291566300.7300.28048119DELTATX51720.19310001.650SNAP1.850Other Nutrition Program0.6200.0400.3404660002.730.2863300.7300.27048121DENTONTX7813210.1431118601.650SNAP1.850Other Nutrition Program0.4100.0300.550576830003.020.187377000.4600.54048139ELLISTX1640920.136223201.650SNAP1.850Other Nutrition Program0.5200.0500.430109170002.870.20189300.5900.41048147FANNINTX337870.16856701.650SNAP1.850Other Nutrition Program0.5700.0500.38028800002.980.22816300.7500.25048181GRAYSONTX1261460.170213801.650SNAP1.850Other Nutrition Program0.5900.0400.38098980002.710.22868500.6900.31048223HOPKINSTX359290.17462401.650SNAP1.850Other Nutrition Program0.6800.0400.28031110002.920.24822500.7700.23048231HUNTTX903220.179162001.650SNAP1.850Other Nutrition Program0.6300.0400.33074850002.710.24553100.7100.29048257KAUFMANTX1148520.148169501.650SNAP1.850Other Nutrition Program0.5300.0600.41082570002.850.20866500.6300.37048277LAMARTX494010.20299701.650SNAP1.850Other Nutrition Program0.6700.0500.27043660002.570.25630000.8600.15048349NAVARROTX482390.17182701.650SNAP1.850Other Nutrition Program0.7200.0500.24034430002.440.24731400.7400.26048397ROCKWALLTX904140.119107701.650SNAP1.850Other Nutrition Program0.3800.0400.58055640003.030.18245700.4200.580,,5005963,0.160,799550,0,0.00,ntfb,http://www.facebook.com/northtexasfoodbank,http://www.facebook.com/northtexasfoodbankntfbhttps://www.ntfb.org/donatehttps://secure.feedingamerica.org/site/SPageServer?pagename=GSNAP_Survey&s_src=X14YDALLA,http://help.feedingamerica.org/images_logos/FoodBankLogo_24_275w.jpghttps://secure.feedingamerica.org/images_logos/FoodBankLogo_24_275w.jpg,https://www.ntfb.org/volunteer,"""Volunteer Coordinator
Sophia Sindalovsky""",sophia@ntfb.org,   .   .    ,          ,282910,0.214,0.620,0.380,23,214.330.1396,214.331.4104,MBR,North,false,www.ntfb.org,,,,,,6391077152077817true,,FB,"2008-10-10T00:00:002019-12-11T14:47:31.057232TrishaCunningham Trisha   CunninghamCunningham, Trisha  MaleCEO2143301396          214.330.1396214.331.4104trisha.cunningham@ntfb.org24","2008-10-10T00:00:002019-12-11T14:47:31.057442AnnaKurian Anna   KurianKurian, Anna  MaleSenior Communications Manager2147246565          214.724.6565214.331.4104annak@ntfb.org24"
184,216,East Texas Food Bank,https://EastTexasFoodBank.org/,0001-01-01T00:00:000001-01-01T00:00:00160-95.33732132.3334123201 Robertson RoadTylerTX75701    75701,2008-04-04T14:46:54,,2020-01-14T14:32:14.187,,48001ANDERSONTX577470.182105201.650SNAP1.850Other Nutrition Program0.5700.0600.37049450002.750.23426200.8800.12048005ANGELINATX877000.189165701.650SNAP1.850Other Nutrition Program0.6500.0400.32083120002.940.25357800.6900.31048037BOWIETX936350.215201801.650SNAP1.850Other Nutrition Program0.6300.0400.34095870002.780.25657000.7600.24048063CAMPTX126700.18323201.650SNAP1.850Other Nutrition Program0.7000.0300.27011450002.890.2488300.7400.26048067CASSTX301180.21063401.650SNAP1.850Other Nutrition Program0.6200.0600.32031050002.870.28119300.7600.24048073CHEROKEETX515940.17791101.650SNAP1.850Other Nutrition Program0.7100.0500.25045240002.910.25233100.8100.19048159FRANKLINTX106390.17018001.650SNAP1.850Other Nutrition Program0.5900.0700.3408540002.780.2436300.6500.35048183GREGGTX1234020.202249201.650SNAP1.850Other Nutrition Program0.7000.0500.250117340002.760.24678600.8000.20048203HARRISONTX666060.198132101.650SNAP1.850Other Nutrition Program0.6100.0500.34061440002.730.24842200.6900.31048213HENDERSONTX796870.178142001.650SNAP1.850Other Nutrition Program0.6500.0500.30072620003.000.25945200.7800.22048225HOUSTONTX228490.22651601.650SNAP1.850Other Nutrition Program0.6600.0100.33023140002.630.29012800.7300.27048289LEONTX169660.18030501.650SNAP1.850Other Nutrition Program0.6400.0400.32014880002.860.27010400.7900.21048315MARIONTX101400.22622901.650SNAP1.850Other Nutrition Program0.7000.0500.25011190002.860.2955600.8500.15048343MORRISTX125300.22127701.650SNAP1.850Other Nutrition Program0.5500.0400.41013210002.790.2717800.6200.38048347NACOGDOCHESTX654110.216141301.650SNAP1.850Other Nutrition Program0.6800.0200.31069570002.890.26039900.7500.25048365PANOLATX235740.19145101.650SNAP1.850Other Nutrition Program0.6300.0600.31021790002.830.24914000.7500.25048379RAINSTX112460.16118101.650SNAP1.850Other Nutrition Program0.6100.0700.3209010002.920.2255300.7300.27048387RED RIVERTX123530.20124801.650SNAP1.850Other Nutrition Program0.7300.0700.20011630002.750.2405900.8500.15048401RUSKTX530260.18296201.650SNAP1.850Other Nutrition Program0.6000.0500.35044560002.710.24330000.7600.24048405SAN AUGUSTINETX84030.23519701.650SNAP1.850Other Nutrition Program0.6900.0500.2709780002.910.3085200.7200.28048419SHELBYTX256890.20652801.650SNAP1.850Other Nutrition Program0.7500.0300.22026310002.920.28019000.8100.19048423SMITHTX2222770.182405001.650SNAP1.850Other Nutrition Program0.6400.0400.320201290002.910.230126900.7100.29048449TITUSTX326640.15349901.650SNAP1.850Other Nutrition Program0.7800.0600.16023220002.730.24723500.7700.24048459UPSHURTX405060.17972701.650SNAP1.850Other Nutrition Program0.5500.0600.39036180002.920.24523800.6600.34048467VAN ZANDTTX536070.16286901.650SNAP1.850Other Nutrition Program0.5900.0500.36044350002.990.23228900.7100.29048499WOODTX433150.16772201.650SNAP1.850Other Nutrition Program0.5600.0700.37037450003.040.24520700.7500.250,,1268354,0.190,240910,0,0.00,ETFoodBank,http://www.facebook.com/etfoodbank,http://www.facebook.com/etfoodbankETFoodBankhttp://easttexasfoodbank.org/donatenow,http://help.feedingamerica.org/images_logos/FoodBankLogo_216_275w.jpghttps://secure.feedingamerica.org/images_logos/FoodBankLogo_216_275w.jpg,http://easttexasfoodbank.org/givetime,Kenny Smith,volunteer@easttexasfoodbank.org,903.617.2016,          ,75370,0.248,0.750,0.250,160,903.597.3663,903.597.7659,MBR,North,false,www.EastTexasFoodBank.org,,,,,,2226687018442235false,,FB,"2008-10-10T00:00:002020-01-14T14:32:14.207239DennisCullinane Dennis   CullinaneCullinane, Dennis  MaleChief Executive Director9035973663          903.597.3663903.597.7659dcullinane@easttexasfoodbank.org216","2008-10-10T00:00:002020-01-14T14:32:14.207449LaurenBarnes Lauren   BarnesBarnes, Lauren  MaleDirector of Communications and Marketing9036172008          903.617.2008903.597.7659lbarnes@easttexasfoodbank.org216"
92,27,Gleaners Community Food Bank of Southeastern Michigan,http://www.gcfb.org/get_help,0001-01-01T00:00:000001-01-01T00:00:0026-83.013670642.35407492131 Beaufait StreetDetroitMI48207    48207,2008-04-04T14:46:54,,2018-03-01T12:13:00.077,,"26093LIVINGSTONMI1869460.074137902.000SNAP, Other Nutrition Programs2.000SNAP, Other Nutrition Programs0.5100.0000.49072060003.060.10343800.5200.48026099MACOMBMI8640190.1211048302.000SNAP, Other Nutrition Programs2.000SNAP, Other Nutrition Programs0.6500.0000.350533490002.980.141263900.6600.34026115MONROEMI1496190.105157402.000SNAP, Other Nutrition Programs2.000SNAP, Other Nutrition Programs0.6500.0000.35077770002.900.14046500.6700.33026125OAKLANDMI12418600.1091354402.000SNAP, Other Nutrition Programs2.000SNAP, Other Nutrition Programs0.5400.0000.460725700003.140.110298900.5200.48026163WAYNEMI17638220.1953444402.000SNAP, Other Nutrition Programs2.000SNAP, Other Nutrition Programs0.8300.0000.1701724290002.930.192810800.6800.320","26692Monroe County Opportunity Program (MCOP)
1140 S. Telegraph RdMonroeMI48161KasprzakStephanie                                   skasprzak@monroecountyop.orghttp://www.monroecountyop.org734.241.2775000.000.000026718Macomb Food Program21885 Dunham Road, Suite 10Clinton TownshipMI48036MalloryShannon                                   shannon.mallory@macombgov.orghttps://mca.macombgov.org/MCA-ES-Food586.469.6004000.000.0000",4206266,0.146,614240,0,0.00,Gleaners,http://www.facebook.com/Gleanersfan,http://www.facebook.com/GleanersfanGleanershttp://www.gcfb.org/donate_rd,http://help.feedingamerica.org/images_logos/FoodBankLogo_27_275w.jpghttps://secure.feedingamerica.org/images_logos/FoodBankLogo_27_275w.jpg,http://www.gcfb.org/volunteer_opportunities,Pertrine Rambus  Volunteer Coordinator,detkhk@gcfb.org,866.GLE.ANER,403       ,146390,0.153,0.640,0.360,26,313.923.3535,313.923.2247,MBR,North,false,www.gcfb.org,,,,,,3915279731785780true,,FB,"2008-10-10T00:00:002018-03-01T12:13:00.097150GeraldBrisson Gerald   BrissonBrisson, Gerald  MalePresident3139233535          313.923.3535313.923.2247gbrisson@gcfb.org27","2008-10-10T00:00:002018-03-01T12:13:00.1360StacyKessel_Stacy _ KesselKessel, Stacy _MaleDirector of Marketing & Communications3139232247          313.923.2247313.923.2247skessel@gcfb.org27"
13,91,Community Food Bank of Southern Arizona,http://www.communityfoodbank.org/Get-Help,0001-01-01T00:00:000001-01-01T00:00:0083-110.926959832.18847713003 South Country Club RoadTucsonAZ85713    85713,2008-04-04T14:46:54,,2020-02-11T16:15:17.04,,"04003COCHISEAZ1265160.139175801.850SNAP, Other Nutrition Programs1.850SNAP, Other Nutrition Programs0.6900.0000.31086770002.890.22563000.7300.27004009GRAHAMAZ377000.14755401.850SNAP, Other Nutrition Programs1.850SNAP, Other Nutrition Programs0.6700.0000.33027810002.940.23824600.7400.26004011GREENLEEAZ93680.11610901.850SNAP, Other Nutrition Programs1.850SNAP, Other Nutrition Programs0.7300.0000.2705520002.970.1955200.6200.38004019PIMAAZ10072570.1361374501.850SNAP, Other Nutrition Programs1.850SNAP, Other Nutrition Programs0.7200.0000.280708940003.020.212463700.7000.30004023SANTA CRUZAZ463580.09644401.850SNAP, Other Nutrition Programs1.850SNAP, Other Nutrition Programs1.0000.0000.00019220002.540.24131200.8100.190",,1227199,0.135,166100,0,0.00,foodbanktucson,http://www.facebook.com/pages/Community-Food-Bank/112454848794673?sk=wall,http://www.facebook.com/pages/Community-Food-Bank/112454848794673?sk=wallfoodbanktucsonhttp://www.communityfoodbank.org/Get-Involved/Ways-to-Give,http://help.feedingamerica.org/images_logos/FoodBankLogo_91_275w.jpghttps://secure.feedingamerica.org/images_logos/FoodBankLogo_91_275w.jpg,http://www.communityfoodbank.org/Volunteer/Individual,Food Procurement and Agency Market Manager ,,520.622.0525,          ,58770,0.216,0.710,0.290,83,520.622.0525,520.624.6349,MBR,North,false,www.communityfoodbank.org,,,,,,3991254832999003true,,FB,"2008-10-10T00:00:002020-02-11T16:15:17.0969MichaelMcDonald Michael   McDonaldMcDonald, Michael  MaleChief Executive Officer5206220525          520.622.0525520.624.6349mmcdonald@communityfoodbank.org91","2008-10-10T00:00:002020-02-11T16:15:17.09279NormaCable Norma   CableCable, Norma  MalePublic Relations and Marketing Specialis5208486574          520.848.6574520.624.6349ncable@communityfoodbank.org91"
151,294,Westmoreland County Food Bank,http://westmorelandfoodbank.org/receive-assistance/,0001-01-01T00:00:000001-01-01T00:00:00180-79.582330940.3963988100 Devonshire DriveDelmontPA15626    15626,2008-04-04T14:46:54,,2019-01-03T14:46:45.027,,42129WESTMORELANDPA3568350.106377401.600SNAP1.850Other Nutrition Program0.5000.0500.460199420003.100.164109900.6000.400,,356835,0.106,37740,0,0.00,WestmorelandFB,http://www.facebook.com/westmorelandfoodbank,http://www.facebook.com/westmorelandfoodbankWestmorelandFBhttps://interland3.donorperfect.net/weblink/weblink.aspx?name=E11129&id=1 idb=1773134344&df_id=1280&https://secure.feedingamerica.org/site/SPageServer?pagename=GSNAP_Survey&s_src=X17YDELMO,http://help.feedingamerica.org/images_logos/FoodBankLogo_294_275w.jpghttps://secure.feedingamerica.org/images_logos/FoodBankLogo_294_275w.jpg,http://westmorelandfoodbank.org/volunteer/,Volunteer Coordinator  Louise Wilhelm,louise@westmorelandfoodbank.org,724.468.8660,13        ,10990,0.164,0.600,0.400,180,724.468.8660,724.468.5894,MBR,North,false,www.westmorelandfoodbank.org,,,,,,67999185612045true,,FB,"2008-10-10T00:00:002019-01-03T14:46:45.057202JenniferMiller Jennifer   MillerMiller, Jennifer  MaleChief Executive Officer7244688660          724.468.8660724.468.5894Jennifer@westmorelandfoodbank.org294","2008-10-10T00:00:002019-01-03T14:46:45.057412JenniferMiller Jennifer   MillerMiller, Jennifer  MaleChief Executive Officer7244688660          724.468.8660724.468.5894jennifer@westmorelandfoodbank.org294"
