rowid,OrganizationID,FullName,AgencyURL,MailAddress,BeginDt,EndDt,UpdateDt,UpdateUserID,ListFipsCounty,ListPDOs,POP_COUNT,FI_AGGREGATE,PUBLIC_FI,WT_ANNUAL_DOLLARS,COST_PER_MEAL,Twitter,FaceBook,SocialUrls,LogoUrls,VolunteerURL,VolunteerCoord,VolunteerEmail,VolunteerPhone,VolunteerPhoneExtension,CHILD_FI_COUNT,CHILD_FI_PCT,CHILD_FI_BELOW_PCT,CHILD_FI_ABOVE_PCT,EntityID,Phone,Fax,Type,Region,DistributionFlag,URL,DemographicStats,OperationsStats,FoodDistributionProgStats,ClientSupportProgStats,NationalProgStats,PoundageStats,AgenciesServedStats,SubType,ED,MediaContact
70,369,Food Finders Food Bank Inc.,https://www.food-finders.org/food-finder/,0001-01-01T00:00:000001-01-01T00:00:00203-86.88430340.4323951204 Greenbush StreetLafayetteIN47904    47904,2008-04-04T14:46:54,,2020-03-03T11:18:30.59,,18007BENTONIN86850.11910301.300SNAP1.850Other Nutrition Program0.6200.1800.2004940002.810.1793900.8500.15018015CARROLLIN199940.10020101.300SNAP1.850Other Nutrition Program0.4900.2100.2909180002.680.1506900.7700.23018017CASSIN382480.10740801.300SNAP1.850Other Nutrition Program0.6400.2100.15016530002.370.16915300.8500.16018023CLINTONIN324550.10032501.300SNAP1.850Other Nutrition Program0.6000.2000.20012780002.300.16313900.8100.19018045FOUNTAININ166200.12020001.300SNAP1.850Other Nutrition Program0.5400.2100.2509530002.790.1616000.7200.28018049FULTONIN202960.11423101.300SNAP1.850Other Nutrition Program0.5200.2000.28011060002.810.1637900.7100.29018067HOWARDIN824570.141116601.300SNAP1.850Other Nutrition Program0.5700.1000.33053370002.680.18835400.7200.28018073JASPERIN334480.10434901.300SNAP1.850Other Nutrition Program0.4200.2400.35018240003.060.15712700.7200.28018103MIAMIIN360350.13649001.300SNAP1.850Other Nutrition Program0.5900.1700.25020210002.420.19515300.8700.14018107MONTGOMERYIN382880.10741201.300SNAP1.850Other Nutrition Program0.4700.2000.33019840002.820.15613800.6600.35018111NEWTONIN140560.12117001.300SNAP1.850Other Nutrition Program0.5800.1700.2508140002.800.1946000.8700.13018131PULASKIIN127610.11714901.300SNAP1.850Other Nutrition Program0.5600.1700.2706630002.610.1725000.7800.22018157TIPPECANOEIN1860810.150278801.300SNAP1.850Other Nutrition Program0.5900.0900.320135370002.850.16363000.6900.31018159TIPTONIN152900.10115501.300SNAP1.850Other Nutrition Program0.5100.1500.3407780002.940.1705500.8000.20018171WARRENIN82690.1008201.300SNAP1.850Other Nutrition Program0.4700.1700.3603910002.790.1622900.7100.29018181WHITEIN242790.09723601.300SNAP1.850Other Nutrition Program0.4900.2500.26011260002.800.1508500.7500.250,,587262,0.127,74650,0,0.00,FoodFinders,http://www.facebook.com/FoodFindersFoodBank,http://www.facebook.com/FoodFindersFoodBankFoodFindershttp://food-finders.org/give/https://secure.feedingamerica.org/site/SPageServer?pagename=GSNAP_Survey&s_src=X16YLAFAY,http://help.feedingamerica.org/images_logos/FoodBankLogo_369_275w.jpghttps://secure.feedingamerica.org/images_logos/FoodBankLogo_369_275w.jpg,https://www.food-finders.org/get-involved/,Danielle Goldberg,dgoldberg@foodfinders.org,765.471.0062,          ,22200,0.168,0.740,0.260,203,765.471.0062,765.471.1101,MBR,North,false,www.food-finders.org,,,,,,85733477053082true,,FB,"2008-10-10T00:00:002020-03-03T11:18:30.62259KatyBunder Katy   BunderBunder, Katy  MaleCEO7654710062          765.471.0062765.471.1101kbunder@food-finders.org369","2008-10-10T00:00:002020-03-03T11:18:30.62469KierCrites Kier   CritesCrites, Kier  MaleChief Philanthropy Officer7654710062219       765.471.0062 X219       765.471.1101kcrites@food-finders.org369"
149,92,Community Food Bank of Eastern Oklahoma,http://okfoodbank.org/get-help/,0001-01-01T00:00:000001-01-01T00:00:0084-95.98275636.1730811304 N. Kenosha Ave.TulsaOK74106    74106,2008-04-04T14:46:54,,2020-04-15T14:17:16.12,,40001ADAIROK221360.19142301.300SNAP1.850Other Nutrition Program0.6800.1300.19021060002.920.28516700.7800.22040021CHEROKEEOK484040.17283201.300SNAP1.850Other Nutrition Program0.5700.1500.27046480003.270.24727400.7500.25040023CHOCTAWOK149790.21732401.300SNAP1.850Other Nutrition Program0.6800.0600.26015890002.870.29410700.6800.32040035CRAIGOK145630.16023301.300SNAP1.850Other Nutrition Program0.5500.2500.21011950003.010.2337500.8700.13040037CREEKOK708990.151107401.300SNAP1.850Other Nutrition Program0.4800.1700.35057700003.150.23039400.6500.35040041DELAWAREOK418780.15665501.300SNAP1.850Other Nutrition Program0.6000.2000.21035520003.180.24821700.8000.20040061HASKELLOK127460.16921501.300SNAP1.850Other Nutrition Program0.6000.1800.22010860002.960.2497700.7400.26040077LATIMEROK106210.18019101.300SNAP1.850Other Nutrition Program0.5800.1000.3209940003.050.2656200.6500.35040079LE FLOREOK498600.17185401.300SNAP1.850Other Nutrition Program0.6000.1500.25043400002.980.25330300.7300.27040089MC CURTAINOK330260.19163201.300SNAP1.850Other Nutrition Program0.6300.1700.21033070003.070.26522200.7500.25040091MC INTOSHOK198740.17835401.300SNAP1.850Other Nutrition Program0.5500.1600.29018440003.050.26410700.7200.28040097MAYESOK409290.16065401.300SNAP1.850Other Nutrition Program0.5600.1300.31034920003.130.24123700.7100.29040101MUSKOGEEOK694710.184128101.300SNAP1.850Other Nutrition Program0.5500.1400.31060870002.780.25543400.7000.30040105NOWATAOK104480.16417101.300SNAP1.850Other Nutrition Program0.5100.1600.3309030003.090.2315600.6800.32040111OKMULGEEOK391210.18271101.300SNAP1.850Other Nutrition Program0.5700.1500.28036280002.990.25323900.7400.26040113OSAGEOK473500.16176501.300SNAP1.850Other Nutrition Program0.4700.1400.38040780003.120.23325200.6500.35040115OTTAWAOK317250.16853201.300SNAP1.850Other Nutrition Program0.6100.1500.24027270003.000.25320000.7500.25040121PITTSBURGOK446730.16071601.300SNAP1.850Other Nutrition Program0.5100.1600.33039050003.200.23323100.7000.30040127PUSHMATAHAOK111320.17219201.300SNAP1.850Other Nutrition Program0.5800.1800.2409670002.950.2586400.7800.23040131ROGERSOK900980.125112201.300SNAP1.850Other Nutrition Program0.3800.1700.45064660003.380.19643100.5800.42040135SEQUOYAHOK413640.18275201.300SNAP1.850Other Nutrition Program0.6400.1300.24038820003.020.27726800.7300.27040143TULSAOK6371230.1581006101.300SNAP1.850Other Nutrition Program0.4800.1500.370533590003.110.216351200.6000.40040145WAGONEROK768300.12999001.300SNAP1.850Other Nutrition Program0.4100.1800.41055010003.260.20038500.6000.40040147WASHINGTONOK518670.14776101.300SNAP1.850Other Nutrition Program0.4800.1400.38036680002.820.22027000.6400.360,,1531117,0.160,244950,0,0.00,okfoodbank,http://www.facebook.com/okfoodbank,http://www.facebook.com/okfoodbankokfoodbankhttps://donatenow.networkforgood.org/CommunityFoodBankofEOK,http://help.feedingamerica.org/images_logos/FoodBankLogo_92_275w.jpghttps://secure.feedingamerica.org/images_logos/FoodBankLogo_92_275w.jpg,http://okfoodbank.org/ways-to-help/volunteer/,Director of Volunteer Services  Kate Pelizzoni,kpelizzoni@cfbeo.org,918.585.2800,112       ,85840,0.229,0.660,0.340,84,918.585.2800,918.585.2862,MBR,North,false,www.okfoodbank.org,,,,,,2806434223192249true,,FB,"2008-10-10T00:00:002020-04-15T14:17:16.18201LoriLongALori A LongLong, Lori AMaleChief Executive Officer9185852800          918.585.2800918.585.2862llong@okfoodbank.org92","2008-10-10T00:00:002020-04-15T14:17:16.18411GregRaskin Greg   RaskinRaskin, Greg  MaleCommunication Manager9189364555          918.936.4555918.585.2862graskin@okfoodbank.org92"
91,34,Feeding America West Michigan Food Bank,https://www.feedwm.org/findfood/,0001-01-01T00:00:000001-01-01T00:00:0032-85.64979743.04848864 West River Center DriveComstock ParkMI49321    49321,2008-04-04T14:46:54,,2020-04-27T08:57:55.153,,"26003ALGERMI92540.13412402.000SNAP, Other Nutrition Programs2.000SNAP, Other Nutrition Programs0.6500.0000.3506840003.230.1782500.8200.18026005ALLEGANMI1141450.091104202.000SNAP, Other Nutrition Programs2.000SNAP, Other Nutrition Programs0.7300.0000.27049400002.780.12836200.7300.27026009ANTRIMMI231330.11626802.000SNAP, Other Nutrition Programs2.000SNAP, Other Nutrition Programs0.7700.0000.23015340003.360.1747600.8500.15026013BARAGAMI85800.14912802.000SNAP, Other Nutrition Programs2.000SNAP, Other Nutrition Programs0.6100.0000.3907180003.290.1923000.7400.26026019BENZIEMI174620.10518402.000SNAP, Other Nutrition Programs2.000SNAP, Other Nutrition Programs0.6900.0000.3109200002.930.1505000.7700.23026021BERRIENMI1549480.145224702.000SNAP, Other Nutrition Programs2.000SNAP, Other Nutrition Programs0.7600.0000.240111770002.910.16958400.7400.26026027CASSMI513970.11659602.000SNAP, Other Nutrition Programs2.000SNAP, Other Nutrition Programs0.7100.0000.29031920003.140.15216600.7300.27026029CHARLEVOIXMI261600.11229202.000SNAP, Other Nutrition Programs2.000SNAP, Other Nutrition Programs0.6600.0000.34017580003.530.1548000.7300.27026033CHIPPEWAMI380230.15558902.000SNAP, Other Nutrition Programs2.000SNAP, Other Nutrition Programs0.7000.0000.30029190002.900.19614000.8000.20026041DELTAMI363950.12645802.000SNAP, Other Nutrition Programs2.000SNAP, Other Nutrition Programs0.7600.0000.25024360003.120.16812400.8300.17026043DICKINSONMI256940.12131102.000SNAP, Other Nutrition Programs2.000SNAP, Other Nutrition Programs0.7600.0000.25017350003.270.1487600.9000.10026047EMMETMI329780.12140002.000SNAP, Other Nutrition Programs2.000SNAP, Other Nutrition Programs0.6900.0000.31019770002.900.15510400.7100.29026053GOGEBICMI155770.14823002.000SNAP, Other Nutrition Programs2.000SNAP, Other Nutrition Programs0.7400.0000.26011720002.990.2145200.8800.12026055GRAND TRAVERSEMI912220.10192602.000SNAP, Other Nutrition Programs2.000SNAP, Other Nutrition Programs0.6800.0000.32047560003.010.12924300.7200.28026061HOUGHTONMI363330.15255202.000SNAP, Other Nutrition Programs2.000SNAP, Other Nutrition Programs0.7600.0000.24030570003.240.15711600.9000.10026067IONIAMI641470.11070602.000SNAP, Other Nutrition Programs2.000SNAP, Other Nutrition Programs0.7500.0000.26031320002.600.14020900.7800.22026071IRONMI112910.12514102.000SNAP, Other Nutrition Programs2.000SNAP, Other Nutrition Programs0.7900.0000.2107220003.000.1833400.8600.15026079KALKASKAMI173580.13924102.000SNAP, Other Nutrition Programs2.000SNAP, Other Nutrition Programs0.7900.0000.21011900002.890.1886900.8400.16026081KENTMI6363760.113719702.000SNAP, Other Nutrition Programs2.000SNAP, Other Nutrition Programs0.7500.0000.250367420002.990.128202300.7000.30026083KEWEENAWMI21360.1352902.000SNAP, Other Nutrition Programs2.000SNAP, Other Nutrition Programs0.8700.0000.1301600003.240.198701.0000.00026085LAKEMI116690.16919702.000SNAP, Other Nutrition Programs2.000SNAP, Other Nutrition Programs0.8100.0000.1908870002.640.2384600.8400.16026089LEELANAUMI215640.08718802.000SNAP, Other Nutrition Programs2.000SNAP, Other Nutrition Programs0.6400.0000.37019830006.180.1324900.7100.29026095LUCEMI64060.1489502.000SNAP, Other Nutrition Programs2.000SNAP, Other Nutrition Programs0.6900.0000.3204810002.970.2202300.8100.19026097MACKINACMI108360.15616902.000SNAP, Other Nutrition Programs2.000SNAP, Other Nutrition Programs0.7600.0000.2408240002.860.2073700.8600.14026101MANISTEEMI244320.12730902.000SNAP, Other Nutrition Programs2.000SNAP, Other Nutrition Programs0.7400.0000.26016720003.170.1817900.8200.18026103MARQUETTEMI671450.13691202.000SNAP, Other Nutrition Programs2.000SNAP, Other Nutrition Programs0.6400.0000.37052000003.340.15418700.6400.37026105MASONMI288000.12535902.000SNAP, Other Nutrition Programs2.000SNAP, Other Nutrition Programs0.7900.0000.21015720002.570.18611100.8200.18026107MECOSTAMI431810.15064602.000SNAP, Other Nutrition Programs2.000SNAP, Other Nutrition Programs0.7500.0000.25028650002.600.19115600.8400.16026109MENOMINEEMI233890.11727302.000SNAP, Other Nutrition Programs2.000SNAP, Other Nutrition Programs0.7500.0000.25014570003.130.1687500.7700.23026113MISSAUKEEMI149820.12418602.000SNAP, Other Nutrition Programs2.000SNAP, Other Nutrition Programs0.8500.0000.1509250002.910.1746000.8900.11026117MONTCALMMI629560.12780202.000SNAP, Other Nutrition Programs2.000SNAP, Other Nutrition Programs0.7800.0000.22038970002.850.17525200.8500.15026121MUSKEGONMI1727070.145251102.000SNAP, Other Nutrition Programs2.000SNAP, Other Nutrition Programs0.7900.0000.210119320002.780.17471100.7600.24026123NEWAYGOMI478990.11956802.000SNAP, Other Nutrition Programs2.000SNAP, Other Nutrition Programs0.8000.0000.20025010002.580.16818500.7700.23026127OCEANAMI263170.11831202.000SNAP, Other Nutrition Programs2.000SNAP, Other Nutrition Programs0.9400.0000.07016500003.100.17810900.9300.07026131ONTONAGONMI60720.1378302.000SNAP, Other Nutrition Programs2.000SNAP, Other Nutrition Programs0.8100.0000.1904300003.040.2051601.0000.00026133OSCEOLAMI232210.14032402.000SNAP, Other Nutrition Programs2.000SNAP, Other Nutrition Programs0.8100.0000.20013910002.520.20711200.8400.16026139OTTAWAMI2802430.084236602.000SNAP, Other Nutrition Programs2.000SNAP, Other Nutrition Programs0.6700.0000.340118640002.940.10975000.6400.36026153SCHOOLCRAFTMI81140.15712702.000SNAP, Other Nutrition Programs2.000SNAP, Other Nutrition Programs0.7600.0000.2406850003.160.2153200.7700.23026159VAN BURENMI751900.11788302.000SNAP, Other Nutrition Programs2.000SNAP, Other Nutrition Programs0.8300.0000.17039600002.630.16329400.7900.21026165WEXFORDMI329150.13243602.000SNAP, Other Nutrition Programs2.000SNAP, Other Nutrition Programs0.8300.0000.17019340002.600.18214100.8800.120",32520The Manna Food Project291 McBride Park CourtHarbor SpringsMI49740BakerKim                                   manna@mannafoodproject.orghttp://mannafoodproject.org/231.347.8852231.348.913532521Western Upper Peninsula Food Bank - BHKCAA962 Dodge StreetHoughtonMI49931LabergeJean                                   bhkcaa@att.nethttp://www.bhkcaa.org906.482.5548906.482.5512,2400647,0.118,284070,0,0.00,feedingwestmich,http://www.facebook.com/FeedingAmericaWestMichigan,http://www.facebook.com/FeedingAmericaWestMichiganfeedingwestmichhttps://www.feedwm.org/donate/,http://help.feedingamerica.org/images_logos/FoodBankLogo_34_275w.jpghttps://secure.feedingamerica.org/images_logos/FoodBankLogo_34_275w.jpg,https://www.feedwm.org/volunteer/,Agency Relations ,,616.784.3250,          ,79950,0.146,0.750,0.250,32,616.784.3250,616.784.3255,MBR,North,false,www.FeedWM.org,,,,,,2507396820633552true,,FB,"2008-10-10T00:00:002020-04-27T08:57:55.183149KennethEstelleRKenneth R EstelleEstelle, Kenneth RMaleChief Executive Director6167843250          616.784.3250616.784.3255kene@feedwm.org34","2008-10-10T00:00:002020-04-27T08:57:55.183359AndrewSteiner Andrew   SteinerSteiner, Andrew  MaleFund Development Specialist6167843250          616.784.3250616.784.3255AndrewS@FeedWM.org34"
99,140,Second Harvest North Central Food Bank,https://secondharvestncfb.com/get-help/find-food/,0001-01-01T00:00:000001-01-01T00:00:00116-93.493421647.22492572222 Cromell DrivePO Box 5130Grand RapidsMN55744    55744,2008-04-04T14:46:54,,2018-06-18T10:51:09.723,,27001AITKINMN158410.10616801.650SNAP1.850Other Nutrition Program0.7100.0500.2408680003.030.1714500.9800.02027021CASSMN288100.11232201.650SNAP1.850Other Nutrition Program0.6800.0300.29016520003.010.19812200.8600.14027035CROW WINGMN635050.09560501.650SNAP1.850Other Nutrition Program0.6400.0400.32030060002.910.14220000.7700.23027061ITASCAMN452370.11250501.650SNAP1.850Other Nutrition Program0.6400.0700.29022550002.620.18217500.8500.15027065KANABECMN159480.10416601.650SNAP1.850Other Nutrition Program0.6700.0500.2808620003.040.1705900.8200.18027071KOOCHICHINGMN127760.12716201.650SNAP1.850Other Nutrition Program0.6400.0400.3208500003.070.2014900.8400.16027095MILLE LACSMN256350.10527001.650SNAP1.850Other Nutrition Program0.6500.0600.29014030003.040.16110100.8400.160,,207752,0.106,21980,0,0.00,food4every1,https://www.facebook.com/SecondHarvestNorthCentral/?ref=your_pages,https://www.facebook.com/SecondHarvestNorthCentral/?ref=your_pagesfood4every1https://secondharvestncfb.com/get-involved/donate/,http://help.feedingamerica.org/images_logos/FoodBankLogo_140_275w.jpghttps://secure.feedingamerica.org/images_logos/FoodBankLogo_140_275w.jpg,https://secondharvestncfb.com/get-involved/volunteer/,,,   .   .    ,          ,7510,0.169,0.830,0.170,116,218.326.4420,218.999.5252,MBR,North,true,www.secondharvestncfb.com,,,,,,42602773422245true,,FB,"2008-10-10T00:00:002018-06-18T10:51:09.743157SusanEstee Susan   EsteeEstee, Susan  MaleExecutive Director2183264420          218.326.4420218.326.0254susan@secondharvestncfb.com140","2008-10-10T00:00:002018-06-18T10:51:09.747367TrishaZimmerman Trisha   ZimmermanZimmerman, Trisha  MaleExecutive Director218326442024        218.326.4420 X24        218.326.0254trisha@secondharvestncfb.com140"
72,102,"Second Harvest Food Bank of East Central Indiana, Inc.",http://www.curehunger.org/get-help/,0001-01-01T00:00:000001-01-01T00:00:0092-85.367931440.23799276621 N. Old SR 3MuncieIN47303    47303,2008-04-04T14:46:54,,2017-01-19T16:56:05.213,,18009BLACKFORDIN122140.12214901.300SNAP1.850Other Nutrition Program0.5300.3000.1806550002.580.1744600.8200.18018035DELAWAREIN1159380.161186601.300SNAP1.850Other Nutrition Program0.6300.1000.28081060002.550.19542800.7400.27018053GRANTIN676150.149100501.300SNAP1.850Other Nutrition Program0.6000.1400.26042300002.470.21029500.8200.18018065HENRYIN486490.13264401.300SNAP1.850Other Nutrition Program0.5500.1300.32027940002.540.19319600.7300.27018075JAYIN211070.13127701.300SNAP1.850Other Nutrition Program0.6600.1300.21013460002.850.19110400.8200.18018095MADISONIN1296410.144186401.300SNAP1.850Other Nutrition Program0.5900.1400.27085210002.680.19355300.7800.22018135RANDOLPHIN252030.13032801.300SNAP1.850Other Nutrition Program0.6300.1200.25013210002.360.19511500.8500.15018169WABASHIN318480.11938001.300SNAP1.850Other Nutrition Program0.5000.1500.35018480002.850.18412500.7100.300,,452215,0.144,65130,0,0.00,curehunger,http://www.facebook.com/curehunger,http://www.facebook.com/curehungercurehungerhttp://www.curehunger.org/get-involved/donate/,http://help.feedingamerica.org/images_logos/FoodBankLogo_102_275w.jpghttps://secure.feedingamerica.org/images_logos/FoodBankLogo_102_275w.jpg,http://www.curehunger.org/get-involved/volunteer/,Leitia McHugh,lmchugh@curehunger.org,765.287.8698,          ,18620,0.195,0.770,0.230,92,765.287.8698,765.287.2036,MBR,North,false,www.curehunger.org,,,,,,72855925931912true,,FB,"2008-10-10T00:00:002017-01-19T16:56:05.24126TimKean Tim   KeanKean, Tim  MalePresident & CEO7652878698          765.287.8698765.287.2036tkean@curehunger.org102","2008-10-10T00:00:002017-01-19T16:56:05.24336KarenMcTague Karen   McTagueMcTague, Karen  MaleMajor Gifts Manager7652878698113       765.287.8698 X113       765.287.2036kmctague@curehunger.org102"
200,145,Facing Hunger Foodbank,http://facinghunger.org/how-we-work/get-assistance,0001-01-01T00:00:000001-01-01T00:00:00119-82.434870638.41769251327 Seventh AvenueHuntingtonWV25701    25701,2008-04-04T14:46:54,,2017-11-27T13:58:44.677,,"21019BOYDKY484860.15675501.300SNAP1.850Other Nutrition Program0.5500.1100.35034570002.680.21622300.6900.31021089GREENUPKY360120.14451801.300SNAP1.850Other Nutrition Program0.5700.1000.34026430002.990.21216500.7100.30021127LAWRENCEKY158440.17327401.300SNAP1.850Other Nutrition Program0.7300.1200.15012840002.750.2338600.8900.11021159MARTINKY121750.18622601.300SNAP1.850Other Nutrition Program0.6300.1700.20011060002.870.2375900.8600.14039087LAWRENCEOH610570.14991201.300SNAP1.850Other Nutrition Program0.5800.1600.26042100002.700.22430600.8000.20054011CABELLWV961000.159152702.000SNAP, Other Nutrition Programs2.000SNAP, Other Nutrition Programs0.6900.0000.31071440002.740.20138500.5900.41054043LINCOLNWV212410.15633202.000SNAP, Other Nutrition Programs2.000SNAP, Other Nutrition Programs0.7800.0000.22017550003.100.24211600.7300.27054045LOGANWV344280.15854502.000SNAP, Other Nutrition Programs2.000SNAP, Other Nutrition Programs0.7300.0000.27025810002.780.22415900.7100.30054053MASONWV270000.14238302.000SNAP, Other Nutrition Programs2.000SNAP, Other Nutrition Programs0.7600.0000.24019110002.920.21412100.7200.28054059MINGOWV251500.18346102.000SNAP, Other Nutrition Programs2.000SNAP, Other Nutrition Programs0.8000.0000.20024030003.050.27015100.7700.23054079PUTNAMWV566440.09855702.000SNAP, Other Nutrition Programs2.000SNAP, Other Nutrition Programs0.5800.0000.42026560002.790.14318500.5100.49054099WAYNEWV410630.14358702.000SNAP, Other Nutrition Programs2.000SNAP, Other Nutrition Programs0.7500.0000.25027920002.790.22019200.7200.280",,475200,0.149,70770,0,0.00,FacingHungerFB,http://www.facebook.com/FacingHunger,http://www.facebook.com/FacingHungerFacingHungerFBhttp://facinghunger.org/how-to-help/donate-funds,http://help.feedingamerica.org/images_logos/FoodBankLogo_145_275w.jpghttps://secure.feedingamerica.org/images_logos/FoodBankLogo_145_275w.jpg,http://facinghunger.org/how-to-help/volunteer,,,   .   .    ,          ,21480,0.211,0.700,0.300,119,304.523.6029,304.523.6086,MBR,North,true,facinghunger.org,,,,,,79676136585754false,,FB,"2008-10-10T00:00:002017-11-27T13:58:44.697253CynthiaKirkhart Cynthia   KirkhartKirkhart, Cynthia  MaleExecutive Director3045236029          304.523.6029304.523.6086Cyndi@facinghunger.org145","2008-10-10T00:00:002017-11-27T13:58:44.697463SuzanneBrady Suzanne   BradyBrady, Suzanne  MaleDirector of Development and Communicatio304523602928        304.523.6029 X28        304.523.6086suzanne@facinghunger.org145"
80,298,Greater Baton Rouge Food Bank,https://brfoodbank.org/get-help/,0001-01-01T00:00:000001-01-01T00:00:00183-91.066721330.472177910600 S. Choctaw DrivePost Office Box 45830Baton RougeLA70815    70815,2008-04-04T14:46:54,,2020-01-15T12:57:19.897,,22005ASCENSIONLA1191290.102121501.300SNAP1.850Other Nutrition Program0.4600.0700.47069660003.360.17456700.4900.51022007ASSUMPTIONLA228810.14733501.300SNAP1.850Other Nutrition Program0.5800.1700.25016940002.960.22411600.8200.19022033EAST BATON ROUGELA4461670.172769101.300SNAP1.850Other Nutrition Program0.5400.1100.360423870003.230.202205500.6300.37022037EAST FELICIANALA195530.15630401.300SNAP1.850Other Nutrition Program0.4800.1100.41016680003.220.2017600.6900.31022047IBERVILLELA331220.17457601.300SNAP1.850Other Nutrition Program0.5100.1800.31030710003.120.22716000.7800.22022063LIVINGSTONLA1370960.093127401.300SNAP1.850Other Nutrition Program0.5300.1200.36069420003.190.18767300.6600.34022077POINTE COUPEELA222710.15233901.300SNAP1.850Other Nutrition Program0.5300.2000.27018420003.180.21410800.7700.23022091ST. HELENALA105090.20021001.300SNAP1.850Other Nutrition Program0.7000.1100.19011510003.210.2505900.7600.24022093ST. JAMESLA214850.16735801.300SNAP1.850Other Nutrition Program0.5100.1300.36019040003.120.21710900.6300.37022121WEST BATON ROUGELA255180.14938001.300SNAP1.850Other Nutrition Program0.5100.0800.41021790003.360.20512700.6300.37022125WEST FELICIANALA153760.14422101.300SNAP1.850Other Nutrition Program0.3500.2400.41012010003.180.2065300.6300.370,,873107,0.148,129030,0,0.00,brfoodbank,http://www.facebook.com/GBRFoodBank,http://www.facebook.com/GBRFoodBankbrfoodbankhttps://brfoodbank.org/give/funds/,http://help.feedingamerica.org/images_logos/FoodBankLogo_298_275w.jpghttps://secure.feedingamerica.org/images_logos/FoodBankLogo_298_275w.jpg,https://volunteer.brfoodbank.org/,Karen Powell - Agency Relastions Coordinator,kpowell@brfoodbank.org,225.359.9940,207       ,41030,0.198,0.630,0.370,183,225.359.9940,225.355.1445,MBR,North,true,www.brfoodbank.org,,,,,,117341319536155true,,FB,"2008-10-10T00:00:002020-01-15T12:57:19.913139MikeManning Mike   ManningManning, Mike  MalePresident and CEO2253599940          225.359.9940225.355.1445mike@brfoodbank.org298","2008-10-10T00:00:002020-01-15T12:57:19.913349JosieBonnette Josie   BonnetteBonnette, Josie  MaleVP of Communications2253599940          225.359.9940225.355.1445josie@brfoodbank.org298"
